,number,value,datetime_start,datetime_complete,duration,params_umap_metric,params_umap_min_dist,params_umap_n_neighbors,state
756,756,0.6542673992673993,2023-11-16 01:58:25.246021,2023-11-16 01:59:36.726519,0 days 00:01:11.480498,cosine,0.06116567569449526,9,COMPLETE
757,757,0.5901007326007326,2023-11-16 01:59:36.736324,2023-11-16 02:00:48.949983,0 days 00:01:12.213659,manhattan,0.9245779330621074,12,COMPLETE
758,758,0.6567673992673992,2023-11-16 02:00:48.956841,2023-11-16 02:02:04.340144,0 days 00:01:15.383303,cosine,0.5728549667425876,10,COMPLETE
759,759,0.6067673992673993,2023-11-16 02:02:04.351643,2023-11-16 02:03:22.742221,0 days 00:01:18.390578,euclidean,0.5052997118322433,5,COMPLETE
760,760,0.6167673992673992,2023-11-16 02:03:22.751162,2023-11-16 02:04:37.866228,0 days 00:01:15.115066,manhattan,0.9532968456540724,13,COMPLETE
761,761,0.6067673992673993,2023-11-16 02:04:37.872334,2023-11-16 02:05:52.922103,0 days 00:01:15.049769,cosine,0.7606538244559016,8,COMPLETE
762,762,0.6167673992673992,2023-11-16 02:05:52.939081,2023-11-16 02:07:05.528864,0 days 00:01:12.589783,manhattan,0.9175741863531491,16,COMPLETE
763,763,0.6467673992673993,2023-11-16 02:07:05.538885,2023-11-16 02:09:09.675375,0 days 00:02:04.136490,minkowski,0.6115855907847474,10,COMPLETE
764,764,0.6567673992673992,2023-11-16 02:09:09.689077,2023-11-16 02:10:24.537111,0 days 00:01:14.848034,cosine,0.7984922540603884,11,COMPLETE
765,765,0.6676007326007326,2023-11-16 02:10:24.543025,2023-11-16 02:11:38.317825,0 days 00:01:13.774800,euclidean,0.7390848012270719,14,COMPLETE
766,766,0.6401007326007326,2023-11-16 02:11:38.326421,2023-11-16 02:12:57.294894,0 days 00:01:18.968473,manhattan,0.8298124999478669,11,COMPLETE
767,767,0.6567673992673992,2023-11-16 02:12:57.303528,2023-11-16 02:14:11.721272,0 days 00:01:14.417744,cosine,0.7306179737969332,12,COMPLETE
768,768,0.6567673992673992,2023-11-16 02:14:11.737585,2023-11-16 02:15:26.756446,0 days 00:01:15.018861,manhattan,0.643010866423059,18,COMPLETE
769,769,0.6467673992673993,2023-11-16 02:15:26.768207,2023-11-16 02:16:38.487533,0 days 00:01:11.719326,cosine,0.886270563662339,10,COMPLETE
770,770,0.6042673992673993,2023-11-16 02:16:38.499404,2023-11-16 02:17:50.676825,0 days 00:01:12.177421,euclidean,0.8565352176159556,7,COMPLETE
771,771,0.6542673992673993,2023-11-16 02:17:50.684571,2023-11-16 02:19:04.928429,0 days 00:01:14.243858,manhattan,0.10967036395499366,9,COMPLETE
772,772,0.6442673992673993,2023-11-16 02:19:04.936665,2023-11-16 02:20:18.182427,0 days 00:01:13.245762,cosine,0.526949618311363,13,COMPLETE
773,773,0.7067673992673993,2023-11-16 02:20:18.192392,2023-11-16 02:21:33.076971,0 days 00:01:14.884579,manhattan,0.7083177914068943,10,COMPLETE
774,774,0.6167673992673992,2023-11-16 02:21:33.109098,2023-11-16 02:22:55.482428,0 days 00:01:22.373330,manhattan,0.7840172480719021,10,COMPLETE
775,775,0.5817673992673993,2023-11-16 02:22:55.491493,2023-11-16 02:24:11.415658,0 days 00:01:15.924165,cosine,0.7455860485591321,9,COMPLETE
776,776,0.6967673992673993,2023-11-16 02:24:11.426908,2023-11-16 02:25:26.188487,0 days 00:01:14.761579,euclidean,0.7750092989591373,10,COMPLETE
777,777,0.5942673992673992,2023-11-16 02:25:26.199621,2023-11-16 02:26:41.129979,0 days 00:01:14.930358,manhattan,0.5515955877529852,9,COMPLETE
778,778,0.6467673992673993,2023-11-16 02:26:41.140291,2023-11-16 02:28:45.304083,0 days 00:02:04.163792,minkowski,0.837577283257721,10,COMPLETE
779,779,0.6067673992673993,2023-11-16 02:28:45.313032,2023-11-16 02:30:00.163241,0 days 00:01:14.850209,cosine,0.8516491365445467,9,COMPLETE
780,780,0.6567673992673992,2023-11-16 02:30:00.174318,2023-11-16 02:31:14.545821,0 days 00:01:14.371503,manhattan,0.7303891723058396,10,COMPLETE
781,781,0.6317673992673993,2023-11-16 02:31:14.553584,2023-11-16 02:32:33.639120,0 days 00:01:19.085536,cosine,0.6640796332886465,10,COMPLETE
782,782,0.6467673992673993,2023-11-16 02:32:33.645539,2023-11-16 02:33:47.744907,0 days 00:01:14.099368,manhattan,0.9362325937139558,9,COMPLETE
783,783,0.5917673992673993,2023-11-16 02:33:47.751652,2023-11-16 02:35:00.112238,0 days 00:01:12.360586,euclidean,0.5455206883559444,15,COMPLETE
784,784,0.6467673992673993,2023-11-16 02:35:00.126932,2023-11-16 02:36:16.324793,0 days 00:01:16.197861,cosine,0.7098738978334941,8,COMPLETE
785,785,0.7098443223443224,2023-11-16 02:36:16.331568,2023-11-16 02:37:31.270575,0 days 00:01:14.939007,manhattan,0.6496718254043057,10,COMPLETE
786,786,0.6098443223443224,2023-11-16 02:37:31.278853,2023-11-16 02:38:45.287834,0 days 00:01:14.008981,manhattan,0.6429574570765421,10,COMPLETE
787,787,0.6167673992673992,2023-11-16 02:38:45.293728,2023-11-16 02:39:58.291689,0 days 00:01:12.997961,manhattan,0.5969701041395775,10,COMPLETE
788,788,0.6042673992673993,2023-11-16 02:39:58.298620,2023-11-16 02:41:13.172930,0 days 00:01:14.874310,manhattan,0.7099595484818365,10,COMPLETE
789,789,0.6467673992673993,2023-11-16 02:41:13.179068,2023-11-16 02:42:30.679678,0 days 00:01:17.500610,manhattan,0.6281853201031206,10,COMPLETE
790,790,0.593434065934066,2023-11-16 02:42:30.689963,2023-11-16 02:43:44.667234,0 days 00:01:13.977271,manhattan,0.6834002119146362,9,COMPLETE
791,791,0.6067673992673993,2023-11-16 02:43:44.675104,2023-11-16 02:45:00.866849,0 days 00:01:16.191745,manhattan,0.5649050131258242,10,COMPLETE
792,792,0.6067673992673993,2023-11-16 02:45:00.879781,2023-11-16 02:46:14.793972,0 days 00:01:13.914191,manhattan,0.6612712127121295,10,COMPLETE
793,793,0.6301007326007326,2023-11-16 02:46:14.802414,2023-11-16 02:47:29.065350,0 days 00:01:14.262936,manhattan,0.8178459730419003,9,COMPLETE
794,794,0.6467673992673993,2023-11-16 02:47:29.074592,2023-11-16 02:48:43.646364,0 days 00:01:14.571772,manhattan,0.797004808089955,10,COMPLETE
795,795,0.6842673992673993,2023-11-16 02:48:43.662477,2023-11-16 02:49:55.253420,0 days 00:01:11.590943,manhattan,0.5871936563659269,9,COMPLETE
796,796,0.6467673992673993,2023-11-16 02:49:55.262575,2023-11-16 02:51:15.966097,0 days 00:01:20.703522,manhattan,0.7546314476376109,10,COMPLETE
797,797,0.5942673992673992,2023-11-16 02:51:15.973487,2023-11-16 02:52:28.800786,0 days 00:01:12.827299,manhattan,0.7623602917391302,9,COMPLETE
798,798,0.6167673992673992,2023-11-16 02:52:28.811135,2023-11-16 02:53:42.592941,0 days 00:01:13.781806,manhattan,0.6727994739453423,8,COMPLETE
799,799,0.6167673992673992,2023-11-16 02:53:42.601520,2023-11-16 02:54:57.481864,0 days 00:01:14.880344,manhattan,0.47440135815558415,10,COMPLETE
800,800,0.6167673992673992,2023-11-16 02:54:57.494387,2023-11-16 02:56:12.007657,0 days 00:01:14.513270,cosine,0.5014768938573737,11,COMPLETE
801,801,0.6967673992673993,2023-11-16 02:56:12.013999,2023-11-16 02:57:26.109624,0 days 00:01:14.095625,manhattan,0.7278293812955553,9,COMPLETE
802,802,0.6567673992673992,2023-11-16 02:57:26.120395,2023-11-16 02:58:41.880088,0 days 00:01:15.759693,cosine,0.5391259373224325,10,COMPLETE
803,803,0.6467673992673993,2023-11-16 02:58:41.888963,2023-11-16 03:00:04.758459,0 days 00:01:22.869496,manhattan,0.9002688670829816,11,COMPLETE
804,804,0.6842673992673993,2023-11-16 03:00:04.766781,2023-11-16 03:01:19.385302,0 days 00:01:14.618521,cosine,0.8730846862156484,10,COMPLETE
805,805,0.6967673992673993,2023-11-16 03:01:19.391691,2023-11-16 03:03:22.826794,0 days 00:02:03.435103,minkowski,0.6164731127867707,9,COMPLETE
806,806,0.6167673992673992,2023-11-16 03:03:22.834809,2023-11-16 03:04:37.978146,0 days 00:01:15.143337,manhattan,0.372828331906696,4,COMPLETE
807,807,0.6467673992673993,2023-11-16 03:04:37.993540,2023-11-16 03:05:52.660053,0 days 00:01:14.666513,cosine,0.7983189166152187,10,COMPLETE
808,808,0.6801007326007327,2023-11-16 03:05:52.668542,2023-11-16 03:07:07.717587,0 days 00:01:15.049045,manhattan,0.6552040327568502,11,COMPLETE
809,809,0.6276007326007326,2023-11-16 03:07:07.728666,2023-11-16 03:08:21.408446,0 days 00:01:13.679780,cosine,0.7681058782115925,10,COMPLETE
810,810,0.5651007326007326,2023-11-16 03:08:21.414529,2023-11-16 03:09:34.889275,0 days 00:01:13.474746,manhattan,0.392500341675212,8,COMPLETE
811,811,0.6401007326007326,2023-11-16 03:09:34.898864,2023-11-16 03:10:58.589099,0 days 00:01:23.690235,cosine,0.5795304200888088,11,COMPLETE
812,812,0.5901007326007326,2023-11-16 03:10:58.600502,2023-11-16 03:12:12.378974,0 days 00:01:13.778472,manhattan,0.1482408661961852,9,COMPLETE
813,813,0.7067673992673993,2023-11-16 03:12:12.387011,2023-11-16 03:13:28.053492,0 days 00:01:15.666481,cosine,0.6027057456945424,10,COMPLETE
814,814,0.5942673992673992,2023-11-16 03:13:28.065926,2023-11-16 03:14:43.086588,0 days 00:01:15.020662,cosine,0.7010784522062274,10,COMPLETE
815,815,0.6167673992673992,2023-11-16 03:14:43.093816,2023-11-16 03:15:54.683667,0 days 00:01:11.589851,cosine,0.5954934542158865,10,COMPLETE
816,816,0.6317673992673993,2023-11-16 03:15:54.692970,2023-11-16 03:17:07.488366,0 days 00:01:12.795396,cosine,0.6317041251716462,10,COMPLETE
817,817,0.7067673992673993,2023-11-16 03:17:07.499840,2023-11-16 03:18:22.448990,0 days 00:01:14.949150,cosine,0.6044537876998285,10,COMPLETE
818,818,0.6067673992673993,2023-11-16 03:18:22.458530,2023-11-16 03:19:37.096965,0 days 00:01:14.638435,cosine,0.6449848306005841,10,COMPLETE
819,819,0.6567673992673992,2023-11-16 03:19:37.107418,2023-11-16 03:20:59.813771,0 days 00:01:22.706353,cosine,0.6043654777191526,10,COMPLETE
820,820,0.6567673992673992,2023-11-16 03:20:59.820678,2023-11-16 03:22:16.253941,0 days 00:01:16.433263,cosine,0.34952182966870815,10,COMPLETE
821,821,0.7067673992673993,2023-11-16 03:22:16.264389,2023-11-16 03:23:32.373704,0 days 00:01:16.109315,cosine,0.6139521593288608,10,COMPLETE
822,822,0.6717673992673994,2023-11-16 03:23:32.382665,2023-11-16 03:24:46.906181,0 days 00:01:14.523516,cosine,0.586106291942093,10,COMPLETE
823,823,0.6567673992673992,2023-11-16 03:24:46.921581,2023-11-16 03:26:02.287175,0 days 00:01:15.365594,cosine,0.6185543137793732,10,COMPLETE
824,824,0.6217673992673993,2023-11-16 03:26:02.297461,2023-11-16 03:27:17.550494,0 days 00:01:15.253033,cosine,0.6102562743346914,10,COMPLETE
825,825,0.7367673992673993,2023-11-16 03:27:17.560013,2023-11-16 03:28:32.857662,0 days 00:01:15.297649,cosine,0.6373976381474351,17,COMPLETE
826,826,0.6442673992673993,2023-11-16 03:28:32.870571,2023-11-16 03:29:56.792731,0 days 00:01:23.922160,cosine,0.641587413350958,10,COMPLETE
827,827,0.5792673992673992,2023-11-16 03:29:56.805089,2023-11-16 03:31:07.729046,0 days 00:01:10.923957,cosine,0.6580420302781985,10,COMPLETE
828,828,0.6967673992673993,2023-11-16 03:31:07.737340,2023-11-16 03:32:22.269128,0 days 00:01:14.531788,cosine,0.6158843404722233,10,COMPLETE
829,829,0.6942673992673993,2023-11-16 03:32:22.278459,2023-11-16 03:33:38.260739,0 days 00:01:15.982280,cosine,0.5760371388434572,17,COMPLETE
830,830,0.6967673992673993,2023-11-16 03:33:38.268260,2023-11-16 03:34:52.471872,0 days 00:01:14.203612,cosine,0.5972082705537064,17,COMPLETE
831,831,0.5942673992673992,2023-11-16 03:34:52.479439,2023-11-16 03:36:05.514159,0 days 00:01:13.034720,cosine,0.6451737676900648,17,COMPLETE
832,832,0.6167673992673992,2023-11-16 03:36:05.521341,2023-11-16 03:37:19.904903,0 days 00:01:14.383562,cosine,0.635007702777835,9,COMPLETE
833,833,0.6467673992673993,2023-11-16 03:37:19.911493,2023-11-16 03:38:34.442996,0 days 00:01:14.531503,cosine,0.5567939122274969,18,COMPLETE
834,834,0.6067673992673993,2023-11-16 03:38:34.451857,2023-11-16 03:39:55.462428,0 days 00:01:21.010571,cosine,0.6091913519779348,18,COMPLETE
835,835,0.6514102564102564,2023-11-16 03:39:55.469442,2023-11-16 03:41:09.745653,0 days 00:01:14.276211,cosine,0.6764768253835187,9,COMPLETE
836,836,0.5901007326007326,2023-11-16 03:41:09.763050,2023-11-16 03:42:23.831092,0 days 00:01:14.068042,cosine,0.681299665702561,6,COMPLETE
837,837,0.6667673992673993,2023-11-16 03:42:23.841423,2023-11-16 03:43:37.297937,0 days 00:01:13.456514,cosine,0.5669522039504428,10,COMPLETE
838,838,0.6067673992673993,2023-11-16 03:43:37.303694,2023-11-16 03:44:53.231619,0 days 00:01:15.927925,cosine,0.689265405065867,17,COMPLETE
839,839,0.6167673992673992,2023-11-16 03:44:53.240558,2023-11-16 03:46:08.526492,0 days 00:01:15.285934,cosine,0.5894771556026731,10,COMPLETE
840,840,0.6419871794871794,2023-11-16 03:46:08.541433,2023-11-16 03:47:20.980643,0 days 00:01:12.439210,cosine,0.6017693683979689,10,COMPLETE
841,841,0.5692673992673993,2023-11-16 03:47:20.992730,2023-11-16 03:48:33.332439,0 days 00:01:12.339709,cosine,0.5439100324657469,18,COMPLETE
842,842,0.6317673992673993,2023-11-16 03:48:33.340823,2023-11-16 03:49:55.112979,0 days 00:01:21.772156,cosine,0.6319216934014806,9,COMPLETE
843,843,0.6514102564102564,2023-11-16 03:49:55.121934,2023-11-16 03:51:10.069196,0 days 00:01:14.947262,cosine,0.6596479924049071,18,COMPLETE
844,844,0.6276007326007326,2023-11-16 03:51:10.083494,2023-11-16 03:52:25.550217,0 days 00:01:15.466723,cosine,0.4892370567037552,10,COMPLETE
845,845,0.6167673992673992,2023-11-16 03:52:25.558316,2023-11-16 03:53:40.237031,0 days 00:01:14.678715,cosine,0.25443526192732224,9,COMPLETE
846,846,0.6567673992673992,2023-11-16 03:53:40.243495,2023-11-16 03:54:54.632475,0 days 00:01:14.388980,cosine,0.6268803613697327,10,COMPLETE
847,847,0.6842673992673993,2023-11-16 03:54:54.640646,2023-11-16 03:56:09.627766,0 days 00:01:14.987120,cosine,0.6574356296313116,10,COMPLETE
848,848,0.6167673992673992,2023-11-16 03:56:09.638361,2023-11-16 03:57:23.981871,0 days 00:01:14.343510,cosine,0.5135947010844663,9,COMPLETE
849,849,0.6842673992673993,2023-11-16 03:57:23.993189,2023-11-16 03:58:37.960980,0 days 00:01:13.967791,cosine,0.7080010795875917,7,COMPLETE
850,850,0.6167673992673992,2023-11-16 03:58:37.967023,2023-11-16 04:00:00.363958,0 days 00:01:22.396935,cosine,0.30017737668220673,10,COMPLETE
851,851,0.6567673992673992,2023-11-16 04:00:00.371461,2023-11-16 04:01:15.606960,0 days 00:01:15.235499,cosine,0.906415646651182,9,COMPLETE
852,852,0.6167673992673992,2023-11-16 04:01:15.620142,2023-11-16 04:02:32.099416,0 days 00:01:16.479274,cosine,0.568979667905621,10,COMPLETE
853,853,0.6276007326007326,2023-11-16 04:02:32.109699,2023-11-16 04:03:48.242994,0 days 00:01:16.133295,cosine,0.6234639554260647,9,COMPLETE
854,854,0.6167673992673992,2023-11-16 04:03:48.254644,2023-11-16 04:05:04.333865,0 days 00:01:16.079221,cosine,0.69014460881157,10,COMPLETE
855,855,0.6167673992673992,2023-11-16 04:05:04.345285,2023-11-16 04:06:20.749525,0 days 00:01:16.404240,cosine,0.27189945067635296,10,COMPLETE
856,856,0.6167673992673992,2023-11-16 04:06:20.761879,2023-11-16 04:07:36.330408,0 days 00:01:15.568529,cosine,0.5856422816855978,9,COMPLETE
857,857,0.6514102564102564,2023-11-16 04:07:36.338055,2023-11-16 04:09:45.460836,0 days 00:02:09.122781,minkowski,0.16269748258613848,10,COMPLETE
858,858,0.6567673992673992,2023-11-16 04:09:45.467251,2023-11-16 04:10:59.875958,0 days 00:01:14.408707,cosine,0.524016670952975,11,COMPLETE
859,859,0.5692673992673993,2023-11-16 04:10:59.883274,2023-11-16 04:12:15.908902,0 days 00:01:16.025628,cosine,0.964030662145181,7,COMPLETE
860,860,0.6967673992673993,2023-11-16 04:12:15.923558,2023-11-16 04:13:31.470222,0 days 00:01:15.546664,cosine,0.4445237659476415,8,COMPLETE
861,861,0.6317673992673993,2023-11-16 04:13:31.478138,2023-11-16 04:14:46.403595,0 days 00:01:14.925457,cosine,0.9243871243449672,10,COMPLETE
862,862,0.6067673992673993,2023-11-16 04:14:46.415638,2023-11-16 04:16:02.618567,0 days 00:01:16.202929,cosine,0.4701023004080311,9,COMPLETE
863,863,0.6092673992673994,2023-11-16 04:16:02.626761,2023-11-16 04:17:14.200545,0 days 00:01:11.573784,cosine,0.6482496632034693,11,COMPLETE
864,864,0.6067673992673993,2023-11-16 04:17:14.211656,2023-11-16 04:19:19.201845,0 days 00:02:04.990189,minkowski,0.1847489260628617,18,COMPLETE
865,865,0.6401007326007326,2023-11-16 04:19:19.212706,2023-11-16 04:20:34.363173,0 days 00:01:15.150467,cosine,0.23397505847393552,8,COMPLETE
866,866,0.5651007326007326,2023-11-16 04:20:34.373100,2023-11-16 04:21:58.760860,0 days 00:01:24.387760,cosine,0.6654381562435545,10,COMPLETE
867,867,0.6542673992673993,2023-11-16 04:21:58.768859,2023-11-16 04:23:13.455542,0 days 00:01:14.686683,cosine,0.7417586322042666,10,COMPLETE
868,868,0.6567673992673992,2023-11-16 04:23:13.468614,2023-11-16 04:24:28.164794,0 days 00:01:14.696180,cosine,0.3156688193693191,9,COMPLETE
869,869,0.6342673992673993,2023-11-16 04:24:28.173943,2023-11-16 04:25:42.792663,0 days 00:01:14.618720,cosine,0.8729418503031078,10,COMPLETE
870,870,0.6042673992673993,2023-11-16 04:25:42.801209,2023-11-16 04:26:55.437845,0 days 00:01:12.636636,cosine,0.5401004469818433,11,COMPLETE
871,871,0.6067673992673993,2023-11-16 04:26:55.451939,2023-11-16 04:29:00.649822,0 days 00:02:05.197883,minkowski,0.7179973201220917,9,COMPLETE
872,872,0.6614102564102564,2023-11-16 04:29:00.656160,2023-11-16 04:30:16.588339,0 days 00:01:15.932179,cosine,0.9411716572555386,10,COMPLETE
873,873,0.6967673992673993,2023-11-16 04:30:16.595442,2023-11-16 04:31:32.466423,0 days 00:01:15.870981,cosine,0.6253489850847793,11,COMPLETE
874,874,0.6567673992673992,2023-11-16 04:31:32.474367,2023-11-16 04:32:56.045403,0 days 00:01:23.571036,cosine,0.6092655625514037,17,COMPLETE
875,875,0.6496245421245421,2023-11-16 04:32:56.057151,2023-11-16 04:34:10.998700,0 days 00:01:14.941549,cosine,0.28682895916600926,8,COMPLETE
876,876,0.6167673992673992,2023-11-16 04:34:11.007467,2023-11-16 04:35:25.053668,0 days 00:01:14.046201,cosine,0.48576543728160326,10,COMPLETE
877,877,0.6167673992673992,2023-11-16 04:35:25.064043,2023-11-16 04:36:39.697659,0 days 00:01:14.633616,cosine,0.554152323873508,9,COMPLETE
878,878,0.6167673992673992,2023-11-16 04:36:39.705051,2023-11-16 04:37:55.638298,0 days 00:01:15.933247,cosine,0.8965574953627807,16,COMPLETE
879,879,0.6998443223443224,2023-11-16 04:37:55.649229,2023-11-16 04:39:59.440426,0 days 00:02:03.791197,minkowski,0.43871680405074515,10,COMPLETE
880,880,0.6276007326007326,2023-11-16 04:39:59.448428,2023-11-16 04:41:15.199379,0 days 00:01:15.750951,cosine,0.8085802804012533,11,COMPLETE
881,881,0.6567673992673992,2023-11-16 04:41:15.208164,2023-11-16 04:42:30.975008,0 days 00:01:15.766844,cosine,0.20228431395049773,9,COMPLETE
882,882,0.6467673992673993,2023-11-16 04:42:30.986312,2023-11-16 04:43:54.460199,0 days 00:01:23.473887,cosine,0.9999386237006976,10,COMPLETE
883,883,0.6427014652014653,2023-11-16 04:43:54.475564,2023-11-16 04:45:09.674437,0 days 00:01:15.198873,cosine,0.9777399450913736,9,COMPLETE
884,884,0.6167673992673992,2023-11-16 04:45:09.687625,2023-11-16 04:46:23.974579,0 days 00:01:14.286954,cosine,0.5800570393817133,10,COMPLETE
885,885,0.6567673992673992,2023-11-16 04:46:23.987087,2023-11-16 04:47:38.295197,0 days 00:01:14.308110,cosine,0.46557914370274445,8,COMPLETE
886,886,0.6067673992673993,2023-11-16 04:47:38.304096,2023-11-16 04:49:42.014805,0 days 00:02:03.710709,minkowski,0.13840444567020196,11,COMPLETE
887,887,0.6542673992673993,2023-11-16 04:49:42.024563,2023-11-16 04:50:56.993978,0 days 00:01:14.969415,cosine,0.8635252071610057,11,COMPLETE
888,888,0.6167673992673992,2023-11-16 04:50:57.001660,2023-11-16 04:52:09.892952,0 days 00:01:12.891292,cosine,0.7626016704378382,3,COMPLETE
889,889,0.7067673992673993,2023-11-16 04:52:09.911012,2023-11-16 04:53:26.421499,0 days 00:01:16.510487,cosine,0.8305744223008058,10,COMPLETE
890,890,0.6539102564102565,2023-11-16 04:53:26.429718,2023-11-16 04:54:49.117748,0 days 00:01:22.688030,cosine,0.6852802705653739,9,COMPLETE
891,891,0.6067673992673993,2023-11-16 04:54:49.129459,2023-11-16 04:56:04.175798,0 days 00:01:15.046339,cosine,0.7241907295772781,9,COMPLETE
892,892,0.6001007326007326,2023-11-16 04:56:04.191768,2023-11-16 04:57:19.665009,0 days 00:01:15.473241,cosine,0.6048244728732711,10,COMPLETE
893,893,0.6167673992673992,2023-11-16 04:57:19.679625,2023-11-16 04:58:34.398455,0 days 00:01:14.718830,cosine,0.5117511945951276,7,COMPLETE
894,894,0.6567673992673992,2023-11-16 04:58:34.406289,2023-11-16 05:00:38.388784,0 days 00:02:03.982495,minkowski,0.24905641414616994,11,COMPLETE
895,895,0.6042673992673993,2023-11-16 05:00:38.399935,2023-11-16 05:01:54.336946,0 days 00:01:15.937011,cosine,0.41280231119426425,10,COMPLETE
896,896,0.6042673992673993,2023-11-16 05:01:54.345083,2023-11-16 05:03:08.570650,0 days 00:01:14.225567,manhattan,0.3269345236669629,10,COMPLETE
897,897,0.6967673992673993,2023-11-16 05:03:08.581589,2023-11-16 05:04:24.236357,0 days 00:01:15.654768,cosine,0.017368755241850435,11,COMPLETE
898,898,0.5817673992673993,2023-11-16 05:04:24.247361,2023-11-16 05:05:45.814444,0 days 00:01:21.567083,cosine,0.21385355058684163,17,COMPLETE
899,899,0.6467673992673993,2023-11-16 05:05:45.822689,2023-11-16 05:06:59.536985,0 days 00:01:13.714296,manhattan,0.6500203276885864,10,COMPLETE
900,900,0.5942673992673992,2023-11-16 05:06:59.544452,2023-11-16 05:08:15.011060,0 days 00:01:15.466608,cosine,0.45642299306125117,8,COMPLETE
901,901,0.6567673992673992,2023-11-16 05:08:15.022528,2023-11-16 05:09:30.675999,0 days 00:01:15.653471,manhattan,0.12726721419055093,9,COMPLETE
902,902,0.6167673992673992,2023-11-16 05:09:30.688951,2023-11-16 05:10:46.269958,0 days 00:01:15.581007,cosine,0.30596371647473,10,COMPLETE
903,903,0.5917673992673993,2023-11-16 05:10:46.284045,2023-11-16 05:12:02.888789,0 days 00:01:16.604744,manhattan,0.34114758307995596,19,COMPLETE
904,904,0.6067673992673993,2023-11-16 05:12:02.899269,2023-11-16 05:13:18.001262,0 days 00:01:15.101993,cosine,0.27428340514764893,11,COMPLETE
905,905,0.6067673992673993,2023-11-16 05:13:18.011044,2023-11-16 05:15:23.705607,0 days 00:02:05.694563,minkowski,0.9472255012148725,9,COMPLETE
906,906,0.6167673992673992,2023-11-16 05:15:23.712784,2023-11-16 05:16:49.755353,0 days 00:01:26.042569,cosine,0.4962009697404911,10,COMPLETE
907,907,0.5776007326007326,2023-11-16 05:16:49.762541,2023-11-16 05:18:06.444293,0 days 00:01:16.681752,manhattan,0.02901812917572212,16,COMPLETE
908,908,0.5917673992673993,2023-11-16 05:18:06.451830,2023-11-16 05:19:21.641376,0 days 00:01:15.189546,cosine,0.4242775916268343,9,COMPLETE
