,number,value,datetime_start,datetime_complete,duration,params_umap_metric,params_umap_min_dist,params_umap_n_neighbors,state
604,604,0.5942673992673992,2023-11-15 22:45:31.869353,2023-11-15 22:46:47.597518,0 days 00:01:15.728165,cosine,0.02029241806615057,13,COMPLETE
605,605,0.6276007326007326,2023-11-15 22:46:47.605633,2023-11-15 22:48:00.551994,0 days 00:01:12.946361,manhattan,0.19732408573398796,11,COMPLETE
606,606,0.5901007326007326,2023-11-15 22:48:00.557479,2023-11-15 22:49:13.186353,0 days 00:01:12.628874,euclidean,0.3117651979091927,10,COMPLETE
607,607,0.6042673992673993,2023-11-15 22:49:13.196432,2023-11-15 22:50:28.597035,0 days 00:01:15.400603,manhattan,0.4400759438590267,9,COMPLETE
608,608,0.5901007326007326,2023-11-15 22:50:28.606976,2023-11-15 22:51:43.388994,0 days 00:01:14.782018,cosine,0.0632863312538274,12,COMPLETE
609,609,0.6167673992673992,2023-11-15 22:51:43.396789,2023-11-15 22:53:06.001690,0 days 00:01:22.604901,manhattan,0.3809069181011335,15,COMPLETE
610,610,0.6442673992673993,2023-11-15 22:53:06.007396,2023-11-15 22:54:20.208869,0 days 00:01:14.201473,cosine,0.28835854907333297,11,COMPLETE
611,611,0.6567673992673992,2023-11-15 22:54:20.220828,2023-11-15 22:55:34.736378,0 days 00:01:14.515550,euclidean,0.12465449923847106,7,COMPLETE
612,612,0.6567673992673992,2023-11-15 22:55:34.746556,2023-11-15 22:56:49.568108,0 days 00:01:14.821552,manhattan,0.08685835757444361,10,COMPLETE
613,613,0.6401007326007326,2023-11-15 22:56:49.574091,2023-11-15 22:58:51.651680,0 days 00:02:02.077589,minkowski,0.25723269225949014,8,COMPLETE
614,614,0.5942673992673992,2023-11-15 22:58:51.660713,2023-11-15 23:00:06.277570,0 days 00:01:14.616857,manhattan,0.3388473176540334,9,COMPLETE
615,615,0.6067673992673993,2023-11-15 23:00:06.287992,2023-11-15 23:01:25.259353,0 days 00:01:18.971361,cosine,0.04632236727030402,13,COMPLETE
616,616,0.6567673992673992,2023-11-15 23:01:25.269208,2023-11-15 23:02:40.027130,0 days 00:01:14.757922,euclidean,0.42242148949167907,10,COMPLETE
617,617,0.6067673992673993,2023-11-15 23:02:40.036300,2023-11-15 23:03:53.710422,0 days 00:01:13.674122,manhattan,0.358438893491086,12,COMPLETE
618,618,0.6442673992673993,2023-11-15 23:03:53.720747,2023-11-15 23:05:10.298229,0 days 00:01:16.577482,cosine,0.5689465326381601,11,COMPLETE
619,619,0.6867673992673993,2023-11-15 23:05:10.307588,2023-11-15 23:06:23.772840,0 days 00:01:13.465252,manhattan,0.49001305146344243,11,COMPLETE
620,620,0.6867673992673993,2023-11-15 23:06:23.786971,2023-11-15 23:07:36.868450,0 days 00:01:13.081479,euclidean,0.987715083547112,14,COMPLETE
621,621,0.5942673992673992,2023-11-15 23:07:36.877548,2023-11-15 23:09:42.909953,0 days 00:02:06.032405,minkowski,0.0217744107863492,9,COMPLETE
622,622,0.6067673992673993,2023-11-15 23:09:42.915356,2023-11-15 23:10:56.913507,0 days 00:01:13.998151,manhattan,0.22371318950347402,10,COMPLETE
623,623,0.6498443223443224,2023-11-15 23:10:56.928510,2023-11-15 23:12:12.438028,0 days 00:01:15.509518,cosine,0.38557222751639986,8,COMPLETE
624,624,0.6467673992673993,2023-11-15 23:12:12.446334,2023-11-15 23:13:23.431737,0 days 00:01:10.985403,manhattan,0.1909016014949813,17,COMPLETE
625,625,0.6467673992673993,2023-11-15 23:13:23.437331,2023-11-15 23:14:37.005867,0 days 00:01:13.568536,euclidean,0.5349284916607879,10,COMPLETE
626,626,0.7342673992673994,2023-11-15 23:14:37.015686,2023-11-15 23:15:51.402978,0 days 00:01:14.387292,cosine,0.31563110295308777,16,COMPLETE
627,627,0.5942673992673992,2023-11-15 23:15:51.409621,2023-11-15 23:17:11.176616,0 days 00:01:19.766995,cosine,0.3349868527390574,16,COMPLETE
628,628,0.6098443223443224,2023-11-15 23:17:11.184847,2023-11-15 23:18:26.808290,0 days 00:01:15.623443,cosine,0.3134405379605314,16,COMPLETE
629,629,0.5917673992673993,2023-11-15 23:18:26.815694,2023-11-15 23:19:43.963604,0 days 00:01:17.147910,cosine,0.3170712637757052,16,COMPLETE
630,630,0.6567673992673992,2023-11-15 23:19:43.975248,2023-11-15 23:20:59.023835,0 days 00:01:15.048587,cosine,0.3623003254971296,14,COMPLETE
631,631,0.6167673992673992,2023-11-15 23:20:59.034169,2023-11-15 23:22:13.347019,0 days 00:01:14.312850,cosine,0.45192088578220746,17,COMPLETE
632,632,0.5751007326007326,2023-11-15 23:22:13.353173,2023-11-15 23:23:24.472029,0 days 00:01:11.118856,cosine,0.40492568890388436,15,COMPLETE
633,633,0.6967673992673993,2023-11-15 23:23:24.498444,2023-11-15 23:24:46.722232,0 days 00:01:22.223788,cosine,0.29635575054993873,17,COMPLETE
634,634,0.6567673992673992,2023-11-15 23:24:46.729221,2023-11-15 23:26:02.713249,0 days 00:01:15.984028,cosine,0.07139965379971425,11,COMPLETE
635,635,0.6067673992673993,2023-11-15 23:26:02.722352,2023-11-15 23:27:17.554840,0 days 00:01:14.832488,cosine,0.47194075879857367,16,COMPLETE
636,636,0.6567673992673992,2023-11-15 23:27:17.565495,2023-11-15 23:28:31.047210,0 days 00:01:13.481715,cosine,0.3379890864656978,15,COMPLETE
637,637,0.6592673992673993,2023-11-15 23:28:31.055272,2023-11-15 23:29:43.705333,0 days 00:01:12.650061,cosine,0.10280297388852529,12,COMPLETE
638,638,0.6001007326007326,2023-11-15 23:29:43.732132,2023-11-15 23:30:58.249865,0 days 00:01:14.517733,manhattan,0.04471374422348427,16,COMPLETE
639,639,0.6067673992673993,2023-11-15 23:30:58.256751,2023-11-15 23:32:15.708820,0 days 00:01:17.452069,cosine,0.0009951700619467152,17,COMPLETE
640,640,0.6067673992673993,2023-11-15 23:32:15.715479,2023-11-15 23:33:30.596685,0 days 00:01:14.881206,manhattan,0.7640570999196912,13,COMPLETE
641,641,0.6167673992673992,2023-11-15 23:33:30.613367,2023-11-15 23:34:44.642415,0 days 00:01:14.029048,euclidean,0.42454753748584484,15,COMPLETE
642,642,0.6567673992673992,2023-11-15 23:34:44.648714,2023-11-15 23:35:59.513236,0 days 00:01:14.864522,cosine,0.391176853820995,11,COMPLETE
643,643,0.6067673992673993,2023-11-15 23:35:59.523456,2023-11-15 23:37:13.042497,0 days 00:01:13.519041,manhattan,0.8322603367650235,12,COMPLETE
644,644,0.6467673992673993,2023-11-15 23:37:13.048449,2023-11-15 23:38:28.162022,0 days 00:01:15.113573,manhattan,0.6536854006608657,11,COMPLETE
645,645,0.6067673992673993,2023-11-15 23:38:28.168908,2023-11-15 23:39:50.929018,0 days 00:01:22.760110,cosine,0.5131984139224126,13,COMPLETE
646,646,0.6467673992673993,2023-11-15 23:39:50.933829,2023-11-15 23:41:07.699913,0 days 00:01:16.766084,euclidean,0.6563244809842776,10,COMPLETE
647,647,0.5651007326007326,2023-11-15 23:41:07.707563,2023-11-15 23:42:19.225551,0 days 00:01:11.517988,manhattan,0.3698503783390881,16,COMPLETE
648,648,0.7014102564102564,2023-11-15 23:42:19.233092,2023-11-15 23:43:33.121790,0 days 00:01:13.888698,cosine,0.8360382218787888,10,COMPLETE
649,649,0.6167673992673992,2023-11-15 23:43:33.127749,2023-11-15 23:44:48.216275,0 days 00:01:15.088526,cosine,0.9987753477256416,11,COMPLETE
650,650,0.6567673992673992,2023-11-15 23:44:48.227061,2023-11-15 23:46:03.652088,0 days 00:01:15.425027,cosine,0.6198828718735342,10,COMPLETE
651,651,0.6198443223443223,2023-11-15 23:46:03.661031,2023-11-15 23:47:24.727256,0 days 00:01:21.066225,cosine,0.7195102774084832,12,COMPLETE
652,652,0.6542673992673993,2023-11-15 23:47:24.734876,2023-11-15 23:48:38.869306,0 days 00:01:14.134430,cosine,0.3244043811330719,11,COMPLETE
653,653,0.6342673992673993,2023-11-15 23:48:38.877733,2023-11-15 23:49:52.146709,0 days 00:01:13.268976,cosine,0.6828451831891093,10,COMPLETE
654,654,0.6167673992673992,2023-11-15 23:49:52.158272,2023-11-15 23:51:08.646190,0 days 00:01:16.487918,cosine,0.9791992022080119,11,COMPLETE
655,655,0.6067673992673993,2023-11-15 23:51:08.654195,2023-11-15 23:52:22.889207,0 days 00:01:14.235012,cosine,0.7480824466693365,13,COMPLETE
656,656,0.6567673992673992,2023-11-15 23:52:22.896961,2023-11-15 23:53:37.611829,0 days 00:01:14.714868,cosine,0.7905969824640384,10,COMPLETE
657,657,0.6498443223443224,2023-11-15 23:53:37.622902,2023-11-15 23:54:51.641098,0 days 00:01:14.018196,cosine,0.7417486178830696,14,COMPLETE
658,658,0.6342673992673993,2023-11-15 23:54:51.647418,2023-11-15 23:56:12.075333,0 days 00:01:20.427915,cosine,0.636999391700884,12,COMPLETE
659,659,0.5692673992673993,2023-11-15 23:56:12.081948,2023-11-15 23:57:28.614602,0 days 00:01:16.532654,cosine,0.5275774213512289,11,COMPLETE
660,660,0.6151007326007326,2023-11-15 23:57:28.628193,2023-11-15 23:58:43.206491,0 days 00:01:14.578298,manhattan,0.6398454915844871,10,COMPLETE
661,661,0.6342673992673993,2023-11-15 23:58:43.215050,2023-11-15 23:59:58.556323,0 days 00:01:15.341273,cosine,0.7054332909630535,12,COMPLETE
662,662,0.6301007326007326,2023-11-15 23:59:58.564940,2023-11-16 00:01:12.780458,0 days 00:01:14.215518,manhattan,0.8119842021604331,15,COMPLETE
663,663,0.6167673992673992,2023-11-16 00:01:12.786717,2023-11-16 00:02:26.950699,0 days 00:01:14.163982,cosine,0.9287408692333052,11,COMPLETE
664,664,0.6442673992673993,2023-11-16 00:02:26.956929,2023-11-16 00:03:47.942173,0 days 00:01:20.985244,manhattan,0.8308969554613963,2,COMPLETE
665,665,0.6567673992673992,2023-11-16 00:03:47.952016,2023-11-16 00:05:02.140904,0 days 00:01:14.188888,manhattan,0.28173445170054023,10,COMPLETE
666,666,0.6342673992673993,2023-11-16 00:05:02.148706,2023-11-16 00:06:17.843282,0 days 00:01:15.694576,cosine,0.56919017176341,11,COMPLETE
667,667,0.6467673992673993,2023-11-16 00:06:17.855856,2023-11-16 00:07:32.179234,0 days 00:01:14.323378,manhattan,0.5759438209248955,14,COMPLETE
668,668,0.7039102564102564,2023-11-16 00:07:32.191455,2023-11-16 00:08:45.894309,0 days 00:01:13.702854,cosine,0.9942640871933222,13,COMPLETE
669,669,0.6167673992673992,2023-11-16 00:08:45.903023,2023-11-16 00:10:01.239687,0 days 00:01:15.336664,cosine,0.9293128129607731,13,COMPLETE
670,670,0.6467673992673993,2023-11-16 00:10:01.246277,2023-11-16 00:11:16.422738,0 days 00:01:15.176461,cosine,0.7664177164837063,13,COMPLETE
671,671,0.6867673992673993,2023-11-16 00:11:16.430297,2023-11-16 00:12:35.328439,0 days 00:01:18.898142,cosine,0.9390062725571648,13,COMPLETE
672,672,0.6067673992673993,2023-11-16 00:12:35.334387,2023-11-16 00:13:48.271420,0 days 00:01:12.937033,cosine,0.7995107792019606,13,COMPLETE
673,673,0.6442673992673993,2023-11-16 00:13:48.282042,2023-11-16 00:15:04.312864,0 days 00:01:16.030822,cosine,0.8579397904565301,14,COMPLETE
674,674,0.6167673992673992,2023-11-16 00:15:04.324425,2023-11-16 00:16:20.109915,0 days 00:01:15.785490,cosine,0.7794007886327459,13,COMPLETE
675,675,0.6442673992673993,2023-11-16 00:16:20.115815,2023-11-16 00:17:34.162363,0 days 00:01:14.046548,cosine,0.8082243847911885,13,COMPLETE
676,676,0.6167673992673992,2023-11-16 00:17:34.168395,2023-11-16 00:18:50.798274,0 days 00:01:16.629879,cosine,0.9612893994594472,12,COMPLETE
677,677,0.6167673992673992,2023-11-16 00:18:50.806969,2023-11-16 00:20:10.942560,0 days 00:01:20.135591,cosine,0.9709827350310638,14,COMPLETE
678,678,0.6167673992673992,2023-11-16 00:20:10.949188,2023-11-16 00:21:24.445244,0 days 00:01:13.496056,cosine,0.9563041936820071,12,COMPLETE
679,679,0.6967673992673993,2023-11-16 00:21:24.459978,2023-11-16 00:22:39.808781,0 days 00:01:15.348803,cosine,0.9125609186532597,13,COMPLETE
680,680,0.6067673992673993,2023-11-16 00:22:39.819937,2023-11-16 00:23:55.167881,0 days 00:01:15.347944,cosine,0.9097509570484941,12,COMPLETE
681,681,0.6467673992673993,2023-11-16 00:23:55.179330,2023-11-16 00:25:12.007244,0 days 00:01:16.827914,cosine,0.9705148658869069,14,COMPLETE
682,682,0.6567673992673992,2023-11-16 00:25:12.013405,2023-11-16 00:26:28.237002,0 days 00:01:16.223597,cosine,0.7539351967863847,13,COMPLETE
683,683,0.5942673992673992,2023-11-16 00:26:28.248311,2023-11-16 00:27:43.230255,0 days 00:01:14.981944,cosine,0.8954986316177814,13,COMPLETE
684,684,0.6167673992673992,2023-11-16 00:27:43.237065,2023-11-16 00:29:04.636400,0 days 00:01:21.399335,cosine,0.9908368068434342,12,COMPLETE
685,685,0.6567673992673992,2023-11-16 00:29:04.642847,2023-11-16 00:30:19.118250,0 days 00:01:14.475403,cosine,0.8733959756288417,7,COMPLETE
686,686,0.6342673992673993,2023-11-16 00:30:19.125405,2023-11-16 00:31:34.622076,0 days 00:01:15.496671,cosine,0.9975492479863584,11,COMPLETE
687,687,0.7098443223443224,2023-11-16 00:31:34.631641,2023-11-16 00:32:49.456679,0 days 00:01:14.825038,cosine,0.8872815021462006,8,COMPLETE
688,688,0.6042673992673993,2023-11-16 00:32:49.463965,2023-11-16 00:34:01.832289,0 days 00:01:12.368324,cosine,0.8605820511379554,8,COMPLETE
689,689,0.5651007326007326,2023-11-16 00:34:01.842199,2023-11-16 00:35:17.802139,0 days 00:01:15.959940,cosine,0.943685907225231,8,COMPLETE
690,690,0.6317673992673993,2023-11-16 00:35:17.807906,2023-11-16 00:36:33.919255,0 days 00:01:16.111349,cosine,0.9616921089362632,7,COMPLETE
691,691,0.6067673992673993,2023-11-16 00:36:33.923618,2023-11-16 00:37:48.929738,0 days 00:01:15.006120,cosine,0.8285329542334561,8,COMPLETE
692,692,0.5942673992673992,2023-11-16 00:37:48.940465,2023-11-16 00:39:03.618224,0 days 00:01:14.677759,manhattan,0.9704387735727179,8,COMPLETE
693,693,0.6467673992673993,2023-11-16 00:39:03.625479,2023-11-16 00:40:18.509738,0 days 00:01:14.884259,manhattan,0.9093926710597133,9,COMPLETE
694,694,0.6001007326007326,2023-11-16 00:40:18.517602,2023-11-16 00:41:33.542276,0 days 00:01:15.024674,cosine,0.8863001691501977,8,COMPLETE
695,695,0.6467673992673993,2023-11-16 00:41:33.550277,2023-11-16 00:42:48.675234,0 days 00:01:15.124957,manhattan,0.8382555493280703,8,COMPLETE
696,696,0.6442673992673993,2023-11-16 00:42:48.685531,2023-11-16 00:44:03.180823,0 days 00:01:14.495292,cosine,0.8431841002009969,9,COMPLETE
697,697,0.6067673992673993,2023-11-16 00:44:03.191289,2023-11-16 00:45:23.162539,0 days 00:01:19.971250,manhattan,0.8722090077503181,8,COMPLETE
698,698,0.6042673992673993,2023-11-16 00:45:23.169526,2023-11-16 00:46:35.998634,0 days 00:01:12.829108,cosine,0.8484525619741334,7,COMPLETE
699,699,0.6467673992673993,2023-11-16 00:46:36.007112,2023-11-16 00:47:50.393178,0 days 00:01:14.386066,manhattan,0.9085467909419374,9,COMPLETE
700,700,0.6167673992673992,2023-11-16 00:47:50.411043,2023-11-16 00:49:06.644967,0 days 00:01:16.233924,cosine,0.7405342424447214,14,COMPLETE
701,701,0.6067673992673993,2023-11-16 00:49:06.651276,2023-11-16 00:50:21.395423,0 days 00:01:14.744147,manhattan,0.8533048649093582,8,COMPLETE
702,702,0.6442673992673993,2023-11-16 00:50:21.403647,2023-11-16 00:51:36.122810,0 days 00:01:14.719163,cosine,0.7261310939782843,9,COMPLETE
703,703,0.6467673992673993,2023-11-16 00:51:36.131236,2023-11-16 00:52:51.119949,0 days 00:01:14.988713,manhattan,0.7646567426437303,9,COMPLETE
704,704,0.6042673992673993,2023-11-16 00:52:51.127912,2023-11-16 00:54:13.030682,0 days 00:01:21.902770,cosine,0.9526940819890733,16,COMPLETE
705,705,0.5901007326007326,2023-11-16 00:54:13.041953,2023-11-16 00:55:27.805869,0 days 00:01:14.763916,manhattan,0.8931584432075161,15,COMPLETE
706,706,0.5876007326007325,2023-11-16 00:55:27.813906,2023-11-16 00:56:43.318806,0 days 00:01:15.504900,euclidean,0.7128890765725925,13,COMPLETE
707,707,0.6167673992673992,2023-11-16 00:56:43.327481,2023-11-16 00:57:58.659345,0 days 00:01:15.331864,cosine,0.9258812407112729,13,COMPLETE
708,708,0.6467673992673993,2023-11-16 00:57:58.666196,2023-11-16 00:59:12.837368,0 days 00:01:14.171172,manhattan,0.876902201436596,9,COMPLETE
709,709,0.6567673992673992,2023-11-16 00:59:12.844390,2023-11-16 01:00:28.474257,0 days 00:01:15.629867,cosine,0.7052139146272328,7,COMPLETE
710,710,0.6001007326007326,2023-11-16 01:00:28.481056,2023-11-16 01:01:48.540569,0 days 00:01:20.059513,manhattan,0.5900604039823677,8,COMPLETE
711,711,0.6567673992673992,2023-11-16 01:01:48.547843,2023-11-16 01:02:59.878161,0 days 00:01:11.330318,euclidean,0.7881617746132424,13,COMPLETE
712,712,0.6667673992673993,2023-11-16 01:02:59.885488,2023-11-16 01:04:15.216803,0 days 00:01:15.331315,cosine,0.939950939368491,10,COMPLETE
713,713,0.5973443223443223,2023-11-16 01:04:15.226817,2023-11-16 01:05:25.849682,0 days 00:01:10.622865,manhattan,0.8468743803636061,12,COMPLETE
714,714,0.5901007326007326,2023-11-16 01:05:25.861440,2023-11-16 01:06:40.048422,0 days 00:01:14.186982,cosine,0.7010203788431099,9,COMPLETE
715,715,0.6942673992673993,2023-11-16 01:06:40.054580,2023-11-16 01:07:55.945972,0 days 00:01:15.891392,manhattan,0.6120077724437838,9,COMPLETE
716,716,0.6567673992673992,2023-11-16 01:07:55.957541,2023-11-16 01:09:12.764650,0 days 00:01:16.807109,cosine,0.8201094987274231,17,COMPLETE
717,717,0.593434065934066,2023-11-16 01:09:12.775765,2023-11-16 01:10:36.625503,0 days 00:01:23.849738,euclidean,0.8839439888792955,14,COMPLETE
718,718,0.6442673992673993,2023-11-16 01:10:36.634750,2023-11-16 01:11:52.613403,0 days 00:01:15.978653,manhattan,0.5955107909857955,10,COMPLETE
719,719,0.5917673992673993,2023-11-16 01:11:52.624352,2023-11-16 01:13:06.516319,0 days 00:01:13.891967,cosine,0.7880423820149106,8,COMPLETE
720,720,0.6467673992673993,2023-11-16 01:13:06.525755,2023-11-16 01:14:21.555387,0 days 00:01:15.029632,manhattan,0.6493039393347819,12,COMPLETE
721,721,0.6467673992673993,2023-11-16 01:14:21.562194,2023-11-16 01:15:36.251733,0 days 00:01:14.689539,cosine,0.6690359938002627,10,COMPLETE
722,722,0.6842673992673993,2023-11-16 01:15:36.259061,2023-11-16 01:16:49.552644,0 days 00:01:13.293583,euclidean,0.8941741634564514,9,COMPLETE
723,723,0.6167673992673992,2023-11-16 01:16:49.563416,2023-11-16 01:18:04.948151,0 days 00:01:15.384735,manhattan,0.779132767184099,11,COMPLETE
724,724,0.6167673992673992,2023-11-16 01:18:04.957950,2023-11-16 01:19:26.115579,0 days 00:01:21.157629,cosine,0.6801588709459498,15,COMPLETE
725,725,0.5942673992673992,2023-11-16 01:19:26.126289,2023-11-16 01:20:40.804194,0 days 00:01:14.677905,manhattan,0.9828667429215793,17,COMPLETE
726,726,0.6167673992673992,2023-11-16 01:20:40.814585,2023-11-16 01:21:56.542545,0 days 00:01:15.727960,cosine,0.8193923940663514,13,COMPLETE
727,727,0.5942673992673992,2023-11-16 01:21:56.551123,2023-11-16 01:23:08.475468,0 days 00:01:11.924345,euclidean,0.9293774701746786,10,COMPLETE
728,728,0.6301007326007326,2023-11-16 01:23:08.483686,2023-11-16 01:24:23.088465,0 days 00:01:14.604779,manhattan,0.9519578687318465,12,COMPLETE
729,729,0.5942673992673992,2023-11-16 01:24:23.095934,2023-11-16 01:25:38.321657,0 days 00:01:15.225723,cosine,0.6657992807899186,8,COMPLETE
730,730,0.6342673992673993,2023-11-16 01:25:38.329593,2023-11-16 01:26:50.074012,0 days 00:01:11.744419,manhattan,0.9941080254842587,9,COMPLETE
731,731,0.6073443223443223,2023-11-16 01:26:50.082736,2023-11-16 01:28:13.162656,0 days 00:01:23.079920,cosine,0.9084813027832473,11,COMPLETE
732,732,0.6567673992673992,2023-11-16 01:28:13.176225,2023-11-16 01:29:27.944422,0 days 00:01:14.768197,euclidean,0.7441606480020165,7,COMPLETE
733,733,0.6067673992673993,2023-11-16 01:29:27.952964,2023-11-16 01:30:43.360016,0 days 00:01:15.407052,manhattan,0.9868347393296701,10,COMPLETE
734,734,0.6301007326007326,2023-11-16 01:30:43.369172,2023-11-16 01:31:58.269342,0 days 00:01:14.900170,cosine,0.964392960526234,12,COMPLETE
735,735,0.6001007326007326,2023-11-16 01:31:58.276048,2023-11-16 01:33:13.916273,0 days 00:01:15.640225,manhattan,0.8092427183401204,16,COMPLETE
736,736,0.6039102564102564,2023-11-16 01:33:13.924356,2023-11-16 01:34:28.772783,0 days 00:01:14.848427,cosine,0.5582205932340794,13,COMPLETE
737,737,0.6067673992673993,2023-11-16 01:34:28.783649,2023-11-16 01:35:43.290840,0 days 00:01:14.507191,manhattan,0.627579415849083,8,COMPLETE
738,738,0.6442673992673993,2023-11-16 01:35:43.300062,2023-11-16 01:37:05.533492,0 days 00:01:22.233430,euclidean,0.9320081042628765,14,COMPLETE
739,739,0.6842673992673993,2023-11-16 01:37:05.541048,2023-11-16 01:38:19.690440,0 days 00:01:14.149392,cosine,0.6340452430859871,10,COMPLETE
740,740,0.6067673992673993,2023-11-16 01:38:19.700398,2023-11-16 01:39:34.550643,0 days 00:01:14.850245,manhattan,0.830767937500026,9,COMPLETE
741,741,0.5942673992673992,2023-11-16 01:39:34.563406,2023-11-16 01:40:49.561991,0 days 00:01:14.998585,cosine,0.8607412036896923,11,COMPLETE
742,742,0.6167673992673992,2023-11-16 01:40:49.571642,2023-11-16 01:42:03.930037,0 days 00:01:14.358395,manhattan,0.8887372238692328,13,COMPLETE
743,743,0.6567673992673992,2023-11-16 01:42:03.939760,2023-11-16 01:43:19.274243,0 days 00:01:15.334483,euclidean,0.7816631600102567,9,COMPLETE
744,744,0.6334340659340659,2023-11-16 01:43:19.284137,2023-11-16 01:44:33.583371,0 days 00:01:14.299234,cosine,0.5965687716176715,6,COMPLETE
745,745,0.6567673992673992,2023-11-16 01:44:33.591069,2023-11-16 01:45:54.460163,0 days 00:01:20.869094,manhattan,0.8139359722170795,10,COMPLETE
746,746,0.5792673992673992,2023-11-16 01:45:54.474091,2023-11-16 01:47:07.283469,0 days 00:01:12.809378,cosine,0.8445212228815376,11,COMPLETE
747,747,0.6067673992673993,2023-11-16 01:47:07.299404,2023-11-16 01:48:23.381138,0 days 00:01:16.081734,manhattan,0.699036581281563,14,COMPLETE
748,748,0.6567673992673992,2023-11-16 01:48:23.392567,2023-11-16 01:49:39.536963,0 days 00:01:16.144396,euclidean,0.8991494130967748,12,COMPLETE
749,749,0.6567673992673992,2023-11-16 01:49:39.550399,2023-11-16 01:50:54.691025,0 days 00:01:15.140626,cosine,0.6761515629555821,10,COMPLETE
750,750,0.6467673992673993,2023-11-16 01:50:54.701923,2023-11-16 01:52:07.404349,0 days 00:01:12.702426,manhattan,0.6168981132858918,11,COMPLETE
751,751,0.6667673992673993,2023-11-16 01:52:07.416020,2023-11-16 01:53:22.700514,0 days 00:01:15.284494,cosine,0.9990768830749777,9,COMPLETE
752,752,0.6467673992673993,2023-11-16 01:53:22.709260,2023-11-16 01:54:42.240642,0 days 00:01:19.531382,manhattan,0.9741474314193688,10,COMPLETE
753,753,0.6801007326007327,2023-11-16 01:54:42.247400,2023-11-16 01:55:57.424905,0 days 00:01:15.177505,cosine,0.6965825188873116,11,COMPLETE
754,754,0.6442673992673993,2023-11-16 01:55:57.433105,2023-11-16 01:57:09.970987,0 days 00:01:12.537882,euclidean,0.8746537241217057,8,COMPLETE
755,755,0.5901007326007326,2023-11-16 01:57:09.976867,2023-11-16 01:58:25.239271,0 days 00:01:15.262404,manhattan,0.34610498266916967,13,COMPLETE
