,number,value,datetime_start,datetime_complete,duration,params_umap_metric,params_umap_min_dist,params_umap_n_neighbors,state
453,453,0.6442673992673993,2023-11-15 19:22:23.833418,2023-11-15 19:23:37.724823,0 days 00:01:13.891405,cosine,0.43759484358534706,13,COMPLETE
454,454,0.6167673992673992,2023-11-15 19:23:37.733907,2023-11-15 19:24:53.380804,0 days 00:01:15.646897,cosine,0.4156832506732765,13,COMPLETE
455,455,0.6067673992673993,2023-11-15 19:24:53.385487,2023-11-15 19:26:06.920415,0 days 00:01:13.534928,cosine,0.4006773723535556,12,COMPLETE
456,456,0.6542673992673993,2023-11-15 19:26:06.927046,2023-11-15 19:27:22.435596,0 days 00:01:15.508550,cosine,0.44506117674874995,14,COMPLETE
457,457,0.6067673992673993,2023-11-15 19:27:22.442959,2023-11-15 19:28:36.746311,0 days 00:01:14.303352,cosine,0.14005539631477285,13,COMPLETE
458,458,0.6542673992673993,2023-11-15 19:28:36.751914,2023-11-15 19:29:48.874073,0 days 00:01:12.122159,cosine,0.06273061477057242,14,COMPLETE
459,459,0.6042673992673993,2023-11-15 19:29:48.884166,2023-11-15 19:31:06.949606,0 days 00:01:18.065440,cosine,0.03703626969083216,8,COMPLETE
460,460,0.7067673992673993,2023-11-15 19:31:06.958421,2023-11-15 19:32:21.959922,0 days 00:01:15.001501,cosine,0.3915293852077419,13,COMPLETE
461,461,0.6467673992673993,2023-11-15 19:32:21.965154,2023-11-15 19:34:27.827534,0 days 00:02:05.862380,minkowski,0.3961979130973587,13,COMPLETE
462,462,0.6167673992673992,2023-11-15 19:34:27.834064,2023-11-15 19:35:42.707017,0 days 00:01:14.872953,manhattan,0.0002977127665496661,13,COMPLETE
463,463,0.6342673992673993,2023-11-15 19:35:42.717145,2023-11-15 19:36:58.058322,0 days 00:01:15.341177,cosine,0.45764695553309276,14,COMPLETE
464,464,0.6414102564102564,2023-11-15 19:36:58.065016,2023-11-15 19:38:17.841328,0 days 00:01:19.776312,manhattan,0.41514860629921957,13,COMPLETE
465,465,0.6167673992673992,2023-11-15 19:38:17.853930,2023-11-15 19:39:32.023893,0 days 00:01:14.169963,cosine,0.518361507727734,13,COMPLETE
466,466,0.6067673992673993,2023-11-15 19:39:32.031873,2023-11-15 19:40:45.692426,0 days 00:01:13.660553,manhattan,0.09638412867492928,12,COMPLETE
467,467,0.6967673992673993,2023-11-15 19:40:45.700652,2023-11-15 19:42:00.849150,0 days 00:01:15.148498,manhattan,0.43107781794254596,14,COMPLETE
468,468,0.6667673992673993,2023-11-15 19:42:00.857279,2023-11-15 19:43:16.110694,0 days 00:01:15.253415,cosine,0.07332174699835252,12,COMPLETE
469,469,0.6567673992673992,2023-11-15 19:43:16.119495,2023-11-15 19:45:24.376962,0 days 00:02:08.257467,minkowski,0.4779271821294775,13,COMPLETE
470,470,0.5692673992673993,2023-11-15 19:45:24.382656,2023-11-15 19:46:38.231987,0 days 00:01:13.849331,manhattan,0.391167623174263,8,COMPLETE
471,471,0.6467673992673993,2023-11-15 19:46:38.240095,2023-11-15 19:47:53.843694,0 days 00:01:15.603599,cosine,0.01963518438377712,9,COMPLETE
472,472,0.6567673992673992,2023-11-15 19:47:53.851885,2023-11-15 19:49:07.782398,0 days 00:01:13.930513,manhattan,0.1649754735876633,12,COMPLETE
473,473,0.6567673992673992,2023-11-15 19:49:07.792715,2023-11-15 19:50:26.852936,0 days 00:01:19.060221,cosine,0.11878650202298802,15,COMPLETE
474,474,0.6067673992673993,2023-11-15 19:50:26.859790,2023-11-15 19:51:40.200781,0 days 00:01:13.340991,manhattan,0.3758248737825424,9,COMPLETE
475,475,0.6942673992673993,2023-11-15 19:51:40.210687,2023-11-15 19:52:56.867398,0 days 00:01:16.656711,cosine,0.24201308549817052,7,COMPLETE
476,476,0.5942673992673992,2023-11-15 19:52:56.877269,2023-11-15 19:55:01.104678,0 days 00:02:04.227409,minkowski,0.033104728757639514,13,COMPLETE
477,477,0.6276007326007326,2023-11-15 19:55:01.113824,2023-11-15 19:56:15.151047,0 days 00:01:14.037223,manhattan,0.26874430930623816,12,COMPLETE
478,478,0.6472435897435898,2023-11-15 19:56:15.156416,2023-11-15 19:57:34.454082,0 days 00:01:19.297666,manhattan,0.057354616883694,9,COMPLETE
479,479,0.6567673992673992,2023-11-15 19:57:34.460256,2023-11-15 19:58:49.817110,0 days 00:01:15.356854,cosine,0.4267221940528306,14,COMPLETE
480,480,0.6342673992673993,2023-11-15 19:58:49.825786,2023-11-15 20:00:04.079596,0 days 00:01:14.253810,manhattan,0.21353404683277935,13,COMPLETE
481,481,0.6001007326007326,2023-11-15 20:00:04.087448,2023-11-15 20:01:19.589444,0 days 00:01:15.501996,cosine,0.49654454989157254,10,COMPLETE
482,482,0.6842673992673993,2023-11-15 20:01:19.598011,2023-11-15 20:02:33.772894,0 days 00:01:14.174883,manhattan,0.3835467706162567,10,COMPLETE
483,483,0.6442673992673993,2023-11-15 20:02:33.778404,2023-11-15 20:04:42.560308,0 days 00:02:08.781904,minkowski,0.4149267060625044,9,COMPLETE
484,484,0.6842673992673993,2023-11-15 20:04:42.568150,2023-11-15 20:05:57.175151,0 days 00:01:14.607001,cosine,0.08522185715834396,8,COMPLETE
485,485,0.6167673992673992,2023-11-15 20:05:57.184206,2023-11-15 20:07:13.179774,0 days 00:01:15.995568,manhattan,0.6906008081379456,12,COMPLETE
486,486,0.6342673992673993,2023-11-15 20:07:13.188838,2023-11-15 20:08:28.338236,0 days 00:01:15.149398,cosine,0.18387920886385864,11,COMPLETE
487,487,0.6167673992673992,2023-11-15 20:08:28.344302,2023-11-15 20:09:44.089301,0 days 00:01:15.744999,manhattan,0.11133248478807073,13,COMPLETE
488,488,0.6167673992673992,2023-11-15 20:09:44.097311,2023-11-15 20:11:03.306773,0 days 00:01:19.209462,cosine,0.5425375839664682,15,COMPLETE
489,489,0.6067673992673993,2023-11-15 20:11:03.311958,2023-11-15 20:12:16.248623,0 days 00:01:12.936665,manhattan,0.45191933276555457,11,COMPLETE
490,490,0.5917673992673993,2023-11-15 20:12:16.258663,2023-11-15 20:14:20.035815,0 days 00:02:03.777152,minkowski,0.13918785909075235,9,COMPLETE
491,491,0.6067673992673993,2023-11-15 20:14:20.044882,2023-11-15 20:15:31.960858,0 days 00:01:11.915976,euclidean,0.04909573102493468,5,COMPLETE
492,492,0.6067673992673993,2023-11-15 20:15:31.966654,2023-11-15 20:16:44.865866,0 days 00:01:12.899212,manhattan,0.015610508634460597,10,COMPLETE
493,493,0.6067673992673993,2023-11-15 20:16:44.875847,2023-11-15 20:18:04.296485,0 days 00:01:19.420638,cosine,0.4029858622568153,12,COMPLETE
494,494,0.6042673992673993,2023-11-15 20:18:04.301432,2023-11-15 20:19:18.096845,0 days 00:01:13.795413,manhattan,0.20778886916857212,11,COMPLETE
495,495,0.6585531135531135,2023-11-15 20:19:18.107023,2023-11-15 20:20:32.738173,0 days 00:01:14.631150,cosine,0.4718890630272389,9,COMPLETE
496,496,0.6401007326007326,2023-11-15 20:20:32.744609,2023-11-15 20:21:47.487377,0 days 00:01:14.742768,euclidean,0.4312328959570535,13,COMPLETE
497,497,0.5901007326007326,2023-11-15 20:21:47.496737,2023-11-15 20:23:01.681369,0 days 00:01:14.184632,manhattan,0.07240935746450634,10,COMPLETE
498,498,0.6667673992673993,2023-11-15 20:23:01.687081,2023-11-15 20:24:20.634574,0 days 00:01:18.947493,cosine,0.16144682135486993,10,COMPLETE
499,499,0.6567673992673992,2023-11-15 20:24:20.645846,2023-11-15 20:25:34.743914,0 days 00:01:14.098068,manhattan,0.2554436953028899,11,COMPLETE
500,500,0.5942673992673992,2023-11-15 20:25:34.750645,2023-11-15 20:27:38.375064,0 days 00:02:03.624419,minkowski,0.8028882892583133,8,COMPLETE
501,501,0.6167673992673992,2023-11-15 20:27:38.386347,2023-11-15 20:28:54.375936,0 days 00:01:15.989589,euclidean,0.3850921059806799,12,COMPLETE
502,502,0.6842673992673993,2023-11-15 20:28:54.384628,2023-11-15 20:30:07.106079,0 days 00:01:12.721451,cosine,0.021133547155457944,9,COMPLETE
503,503,0.6342673992673993,2023-11-15 20:30:07.112124,2023-11-15 20:31:20.202497,0 days 00:01:13.090373,manhattan,0.36564728757513226,11,COMPLETE
504,504,0.6467673992673993,2023-11-15 20:31:20.207663,2023-11-15 20:32:39.840004,0 days 00:01:19.632341,manhattan,0.2793180347137454,12,COMPLETE
505,505,0.6567673992673992,2023-11-15 20:32:39.846287,2023-11-15 20:33:53.956005,0 days 00:01:14.109718,euclidean,0.22264997125108799,14,COMPLETE
506,506,0.6442673992673993,2023-11-15 20:33:53.966156,2023-11-15 20:35:08.785099,0 days 00:01:14.818943,cosine,0.04166471503526256,10,COMPLETE
507,507,0.6067673992673993,2023-11-15 20:35:08.792978,2023-11-15 20:36:23.924296,0 days 00:01:15.131318,manhattan,0.6006149451669204,10,COMPLETE
508,508,0.6251007326007325,2023-11-15 20:36:23.930469,2023-11-15 20:37:39.073610,0 days 00:01:15.143141,cosine,0.5296661324236552,9,COMPLETE
509,509,0.6301007326007326,2023-11-15 20:37:39.079012,2023-11-15 20:39:48.336864,0 days 00:02:09.257852,minkowski,0.4476594728101408,11,COMPLETE
510,510,0.6467673992673993,2023-11-15 20:39:48.344739,2023-11-15 20:41:01.122943,0 days 00:01:12.778204,euclidean,0.5013654265091333,13,COMPLETE
511,511,0.6567673992673992,2023-11-15 20:41:01.130332,2023-11-15 20:42:15.966777,0 days 00:01:14.836445,manhattan,0.5609088454166214,8,COMPLETE
512,512,0.6067673992673993,2023-11-15 20:42:15.973111,2023-11-15 20:43:30.982517,0 days 00:01:15.009406,cosine,0.09059784074685284,10,COMPLETE
513,513,0.6467673992673993,2023-11-15 20:43:30.988215,2023-11-15 20:44:45.655516,0 days 00:01:14.667301,manhattan,0.41036386101545813,11,COMPLETE
514,514,0.6842673992673993,2023-11-15 20:44:45.662790,2023-11-15 20:46:01.888382,0 days 00:01:16.225592,euclidean,0.9450427205291146,9,COMPLETE
515,515,0.6067673992673993,2023-11-15 20:46:01.894014,2023-11-15 20:47:16.512629,0 days 00:01:14.618615,cosine,0.3564775239716743,12,COMPLETE
516,516,0.6467673992673993,2023-11-15 20:47:16.518257,2023-11-15 20:48:31.524633,0 days 00:01:15.006376,manhattan,0.06213103806005712,11,COMPLETE
517,517,0.5942673992673992,2023-11-15 20:48:31.534990,2023-11-15 20:49:46.094726,0 days 00:01:14.559736,cosine,0.12186954358337987,10,COMPLETE
518,518,0.5817673992673993,2023-11-15 20:49:46.102470,2023-11-15 20:50:56.965938,0 days 00:01:10.863468,manhattan,0.38378916036724686,9,COMPLETE
519,519,0.6442673992673993,2023-11-15 20:50:56.971955,2023-11-15 20:53:03.689702,0 days 00:02:06.717747,minkowski,0.003183643846241431,13,COMPLETE
520,520,0.5942673992673992,2023-11-15 20:53:03.695574,2023-11-15 20:54:17.097270,0 days 00:01:13.401696,euclidean,0.18144452025063795,11,COMPLETE
521,521,0.5942673992673992,2023-11-15 20:54:17.106300,2023-11-15 20:55:31.975767,0 days 00:01:14.869467,manhattan,0.2978154589232724,10,COMPLETE
522,522,0.6276007326007326,2023-11-15 20:55:31.984973,2023-11-15 20:56:48.269520,0 days 00:01:16.284547,cosine,0.2411045975390791,14,COMPLETE
523,523,0.6467673992673993,2023-11-15 20:56:48.280174,2023-11-15 20:58:02.712791,0 days 00:01:14.432617,manhattan,0.48039954527768813,11,COMPLETE
524,524,0.6067673992673993,2023-11-15 20:58:02.721210,2023-11-15 20:59:21.600509,0 days 00:01:18.879299,euclidean,0.6255170456736936,8,COMPLETE
525,525,0.6342673992673993,2023-11-15 20:59:21.612331,2023-11-15 21:00:33.700881,0 days 00:01:12.088550,cosine,0.029872801391025484,12,COMPLETE
526,526,0.7067673992673993,2023-11-15 21:00:33.708699,2023-11-15 21:01:48.842701,0 days 00:01:15.134002,manhattan,0.3993258329141727,10,COMPLETE
527,527,0.6442673992673993,2023-11-15 21:01:48.854556,2023-11-15 21:03:03.504995,0 days 00:01:14.650439,manhattan,0.1508658650745048,10,COMPLETE
528,528,0.6567673992673992,2023-11-15 21:03:03.511154,2023-11-15 21:04:18.022298,0 days 00:01:14.511144,manhattan,0.43016539196613246,10,COMPLETE
529,529,0.5901007326007326,2023-11-15 21:04:18.028043,2023-11-15 21:05:30.826787,0 days 00:01:12.798744,manhattan,0.45448692268910357,9,COMPLETE
530,530,0.6067673992673993,2023-11-15 21:05:30.832641,2023-11-15 21:06:49.271146,0 days 00:01:18.438505,manhattan,0.08698489274381327,10,COMPLETE
531,531,0.5901007326007326,2023-11-15 21:06:49.280514,2023-11-15 21:08:03.096405,0 days 00:01:13.815891,manhattan,0.40019707056737525,9,COMPLETE
532,532,0.6342673992673993,2023-11-15 21:08:03.105903,2023-11-15 21:09:15.611039,0 days 00:01:12.505136,manhattan,0.34652298121716996,10,COMPLETE
533,533,0.6667673992673993,2023-11-15 21:09:15.617095,2023-11-15 21:10:27.960047,0 days 00:01:12.342952,manhattan,0.6673282699227424,10,COMPLETE
534,534,0.6967673992673993,2023-11-15 21:10:27.966576,2023-11-15 21:11:42.642022,0 days 00:01:14.675446,manhattan,0.1994648524526037,9,COMPLETE
535,535,0.6567673992673992,2023-11-15 21:11:42.655617,2023-11-15 21:13:03.752886,0 days 00:01:21.097269,manhattan,0.8760274198953127,11,COMPLETE
536,536,0.6967673992673993,2023-11-15 21:13:03.763582,2023-11-15 21:14:18.583511,0 days 00:01:14.819929,manhattan,0.05394524420276134,10,COMPLETE
537,537,0.6567673992673992,2023-11-15 21:14:18.594258,2023-11-15 21:16:23.925771,0 days 00:02:05.331513,minkowski,0.2808873236362878,9,COMPLETE
538,538,0.5942673992673992,2023-11-15 21:16:23.932912,2023-11-15 21:17:37.654229,0 days 00:01:13.721317,euclidean,0.5176026325518377,10,COMPLETE
539,539,0.6067673992673993,2023-11-15 21:17:37.662360,2023-11-15 21:18:52.527078,0 days 00:01:14.864718,manhattan,0.4189113966455539,9,COMPLETE
540,540,0.6342673992673993,2023-11-15 21:18:52.536258,2023-11-15 21:20:09.524264,0 days 00:01:16.988006,manhattan,0.37246389106857386,11,COMPLETE
541,541,0.620934065934066,2023-11-15 21:20:09.532656,2023-11-15 21:21:24.215593,0 days 00:01:14.682937,euclidean,0.03299519220123054,7,COMPLETE
542,542,0.6051007326007326,2023-11-15 21:21:24.225376,2023-11-15 21:22:35.659433,0 days 00:01:11.434057,manhattan,0.32138391202852895,8,COMPLETE
543,543,0.6467673992673993,2023-11-15 21:22:35.672732,2023-11-15 21:23:49.853649,0 days 00:01:14.180917,manhattan,0.4623608214638333,10,COMPLETE
544,544,0.6567673992673992,2023-11-15 21:23:49.859145,2023-11-15 21:25:52.791936,0 days 00:02:02.932791,minkowski,0.07423681751149194,11,COMPLETE
545,545,0.6042673992673993,2023-11-15 21:25:52.797816,2023-11-15 21:27:07.011608,0 days 00:01:14.213792,euclidean,0.10230988587046197,10,COMPLETE
546,546,0.6342673992673993,2023-11-15 21:27:07.023644,2023-11-15 21:28:26.498219,0 days 00:01:19.474575,manhattan,0.29895915683618024,9,COMPLETE
547,547,0.6467673992673993,2023-11-15 21:28:26.508943,2023-11-15 21:29:39.516721,0 days 00:01:13.007778,manhattan,0.26345090680779176,10,COMPLETE
548,548,0.6301007326007326,2023-11-15 21:29:39.521930,2023-11-15 21:30:52.456113,0 days 00:01:12.934183,euclidean,0.36906621374675685,11,COMPLETE
549,549,0.5942673992673992,2023-11-15 21:30:52.461545,2023-11-15 21:32:05.600575,0 days 00:01:13.139030,manhattan,0.404169575361225,8,COMPLETE
550,550,0.6067673992673993,2023-11-15 21:32:05.606244,2023-11-15 21:34:08.966813,0 days 00:02:03.360569,minkowski,0.13879895555724928,9,COMPLETE
551,551,0.6967673992673993,2023-11-15 21:34:08.973574,2023-11-15 21:35:28.191496,0 days 00:01:19.217922,manhattan,0.0018690576546123508,10,COMPLETE
552,552,0.6301007326007326,2023-11-15 21:35:28.198109,2023-11-15 21:36:42.258477,0 days 00:01:14.060368,euclidean,0.4364139846818462,11,COMPLETE
553,553,0.6167673992673992,2023-11-15 21:36:42.265056,2023-11-15 21:37:55.297980,0 days 00:01:13.032924,manhattan,0.33716023961882113,10,COMPLETE
554,554,0.6301007326007326,2023-11-15 21:37:55.309046,2023-11-15 21:39:09.607219,0 days 00:01:14.298173,manhattan,0.04730494471414643,11,COMPLETE
555,555,0.5942673992673992,2023-11-15 21:39:09.618171,2023-11-15 21:40:24.065749,0 days 00:01:14.447578,euclidean,0.22892194300631327,9,COMPLETE
556,556,0.6067673992673993,2023-11-15 21:40:24.074804,2023-11-15 21:41:38.671147,0 days 00:01:14.596343,manhattan,0.17708649641221558,14,COMPLETE
557,557,0.6567673992673992,2023-11-15 21:41:38.677098,2023-11-15 21:43:46.564699,0 days 00:02:07.887601,minkowski,0.11480826964352003,13,COMPLETE
558,558,0.6717673992673994,2023-11-15 21:43:46.576709,2023-11-15 21:44:58.650707,0 days 00:01:12.073998,manhattan,0.38882819445607325,10,COMPLETE
559,559,0.6114102564102564,2023-11-15 21:44:58.657280,2023-11-15 21:46:10.317012,0 days 00:01:11.659732,euclidean,0.35222426036848364,9,COMPLETE
560,560,0.6467673992673993,2023-11-15 21:46:10.328211,2023-11-15 21:47:23.949159,0 days 00:01:13.620948,manhattan,0.4852334908457505,16,COMPLETE
561,561,0.6467673992673993,2023-11-15 21:47:23.958979,2023-11-15 21:48:38.369908,0 days 00:01:14.410929,cosine,0.06600957093824876,11,COMPLETE
562,562,0.5776007326007326,2023-11-15 21:48:38.379344,2023-11-15 21:50:01.908412,0 days 00:01:23.529068,manhattan,0.31382574529547513,15,COMPLETE
563,563,0.6942673992673993,2023-11-15 21:50:01.914968,2023-11-15 21:51:13.696029,0 days 00:01:11.781061,euclidean,0.5554158983369912,6,COMPLETE
564,564,0.6771245421245422,2023-11-15 21:51:13.701649,2023-11-15 21:52:25.465968,0 days 00:01:11.764319,cosine,0.42399237400482487,8,COMPLETE
565,565,0.6467673992673993,2023-11-15 21:52:25.471639,2023-11-15 21:53:39.649600,0 days 00:01:14.177961,manhattan,0.030431893192688374,13,COMPLETE
566,566,0.6067673992673993,2023-11-15 21:53:39.658382,2023-11-15 21:55:42.823491,0 days 00:02:03.165109,minkowski,0.5181548243570885,12,COMPLETE
567,567,0.6467673992673993,2023-11-15 21:55:42.832420,2023-11-15 21:56:55.530243,0 days 00:01:12.697823,manhattan,0.1660676722380196,10,COMPLETE
568,568,0.6442673992673993,2023-11-15 21:56:55.538468,2023-11-15 21:58:17.057623,0 days 00:01:21.519155,cosine,0.01996812474393621,9,COMPLETE
569,569,0.6270238095238095,2023-11-15 21:58:17.065065,2023-11-15 21:59:30.381665,0 days 00:01:13.316600,euclidean,0.44251486157069864,10,COMPLETE
570,570,0.6467673992673993,2023-11-15 21:59:30.391477,2023-11-15 22:00:45.747389,0 days 00:01:15.355912,manhattan,0.36988598733090783,11,COMPLETE
571,571,0.6542673992673993,2023-11-15 22:00:45.759890,2023-11-15 22:02:01.349878,0 days 00:01:15.589988,cosine,0.20688026552121674,10,COMPLETE
572,572,0.6467673992673993,2023-11-15 22:02:01.360272,2023-11-15 22:03:16.926842,0 days 00:01:15.566570,manhattan,0.5840000006216756,14,COMPLETE
573,573,0.5917673992673993,2023-11-15 22:03:16.935874,2023-11-15 22:04:31.541686,0 days 00:01:14.605812,euclidean,0.09009294052265754,3,COMPLETE
574,574,0.6167673992673992,2023-11-15 22:04:31.547720,2023-11-15 22:05:50.334742,0 days 00:01:18.787022,cosine,0.25226098454209406,11,COMPLETE
575,575,0.6067673992673993,2023-11-15 22:05:50.342955,2023-11-15 22:07:53.983154,0 days 00:02:03.640199,minkowski,0.4067576183112586,11,COMPLETE
576,576,0.6217673992673993,2023-11-15 22:07:53.991640,2023-11-15 22:09:06.772825,0 days 00:01:12.781185,manhattan,0.2751426440142693,9,COMPLETE
577,577,0.6967673992673993,2023-11-15 22:09:06.778573,2023-11-15 22:10:21.122541,0 days 00:01:14.343968,manhattan,0.7222859896886729,12,COMPLETE
578,578,0.6567673992673992,2023-11-15 22:10:21.133419,2023-11-15 22:11:35.071615,0 days 00:01:13.938196,euclidean,0.5404827585675475,10,COMPLETE
579,579,0.6636904761904762,2023-11-15 22:11:35.081524,2023-11-15 22:12:48.821339,0 days 00:01:13.739815,cosine,0.05081790936651091,8,COMPLETE
580,580,0.6098443223443224,2023-11-15 22:12:48.827944,2023-11-15 22:14:09.377064,0 days 00:01:20.549120,manhattan,0.3324256252157435,13,COMPLETE
581,581,0.6667673992673993,2023-11-15 22:14:09.383739,2023-11-15 22:15:24.790086,0 days 00:01:15.406347,cosine,0.3947964829868692,9,COMPLETE
582,582,0.6667673992673993,2023-11-15 22:15:24.801444,2023-11-15 22:16:38.224368,0 days 00:01:13.422924,euclidean,0.4743146721444867,11,COMPLETE
583,583,0.6498443223443224,2023-11-15 22:16:38.232671,2023-11-15 22:17:54.007370,0 days 00:01:15.774699,manhattan,0.13437276367763867,10,COMPLETE
584,584,0.5917673992673993,2023-11-15 22:17:54.013805,2023-11-15 22:19:57.578496,0 days 00:02:03.564691,minkowski,0.34777539414722874,12,COMPLETE
585,585,0.6067673992673993,2023-11-15 22:19:57.589335,2023-11-15 22:21:17.006983,0 days 00:01:19.417648,manhattan,0.07109225397294254,11,COMPLETE
586,586,0.6167673992673992,2023-11-15 22:21:17.013084,2023-11-15 22:22:32.172933,0 days 00:01:15.159849,cosine,0.2986584552232625,10,COMPLETE
587,587,0.6467673992673993,2023-11-15 22:22:32.183481,2023-11-15 22:23:46.443346,0 days 00:01:14.259865,euclidean,0.499175567328513,9,COMPLETE
588,588,0.6967673992673993,2023-11-15 22:23:46.455443,2023-11-15 22:25:00.994692,0 days 00:01:14.539249,manhattan,0.7794752816155888,10,COMPLETE
589,589,0.6067673992673993,2023-11-15 22:25:01.003024,2023-11-15 22:26:15.464778,0 days 00:01:14.461754,cosine,0.8638190309184871,9,COMPLETE
590,590,0.6317673992673993,2023-11-15 22:26:15.472861,2023-11-15 22:27:28.942345,0 days 00:01:13.469484,manhattan,0.0010177517569418364,11,COMPLETE
591,591,0.6067673992673993,2023-11-15 22:27:28.951865,2023-11-15 22:28:49.099640,0 days 00:01:20.147775,euclidean,0.9504581292863495,12,COMPLETE
592,592,0.6042673992673993,2023-11-15 22:28:49.107835,2023-11-15 22:30:01.949504,0 days 00:01:12.841669,manhattan,0.3797563815707784,10,COMPLETE
593,593,0.5942673992673992,2023-11-15 22:30:01.959355,2023-11-15 22:31:16.781927,0 days 00:01:14.822572,cosine,0.2298536673069849,9,COMPLETE
594,594,0.6317673992673993,2023-11-15 22:31:16.793706,2023-11-15 22:33:21.116257,0 days 00:02:04.322551,minkowski,0.4209554354703913,8,COMPLETE
595,595,0.5901007326007326,2023-11-15 22:33:21.123700,2023-11-15 22:34:37.529424,0 days 00:01:16.405724,manhattan,0.6073593813530536,13,COMPLETE
596,596,0.5917673992673993,2023-11-15 22:34:37.541112,2023-11-15 22:35:52.966279,0 days 00:01:15.425167,cosine,0.10210042562300879,7,COMPLETE
597,597,0.6001007326007326,2023-11-15 22:35:52.974992,2023-11-15 22:37:11.528958,0 days 00:01:18.553966,euclidean,0.45868415125866935,14,COMPLETE
598,598,0.6167673992673992,2023-11-15 22:37:11.536646,2023-11-15 22:38:26.084849,0 days 00:01:14.548203,manhattan,0.03814622910358504,11,COMPLETE
599,599,0.6567673992673992,2023-11-15 22:38:26.092093,2023-11-15 22:39:41.466436,0 days 00:01:15.374343,manhattan,0.3607180544615103,11,COMPLETE
600,600,0.6192673992673993,2023-11-15 22:39:41.478106,2023-11-15 22:40:52.558740,0 days 00:01:11.080634,cosine,0.6802930223185668,10,COMPLETE
601,601,0.5901007326007326,2023-11-15 22:40:52.567271,2023-11-15 22:42:06.316355,0 days 00:01:13.749084,euclidean,0.9126061304431584,12,COMPLETE
602,602,0.6067673992673993,2023-11-15 22:42:06.329447,2023-11-15 22:43:22.605296,0 days 00:01:16.275849,manhattan,0.16024193506640516,10,COMPLETE
603,603,0.6067673992673993,2023-11-15 22:43:22.614575,2023-11-15 22:45:31.862910,0 days 00:02:09.248335,minkowski,0.40564292799321,9,COMPLETE
