,number,value,datetime_start,datetime_complete,duration,params_umap_metric,params_umap_min_dist,params_umap_n_neighbors,state
302,302,0.5942673992673992,2023-11-15 15:55:19.005891,2023-11-15 15:56:31.082607,0 days 00:01:12.076716,euclidean,0.4447201568486826,10,COMPLETE
303,303,0.6067673992673993,2023-11-15 15:56:31.090211,2023-11-15 15:57:48.661971,0 days 00:01:17.571760,cosine,0.4709953378338789,9,COMPLETE
304,304,0.6347435897435897,2023-11-15 15:57:48.667220,2023-11-15 15:59:04.106051,0 days 00:01:15.438831,euclidean,0.4050889738968529,12,COMPLETE
305,305,0.6167673992673992,2023-11-15 15:59:04.113883,2023-11-15 16:00:18.526039,0 days 00:01:14.412156,cosine,0.07811300135393212,11,COMPLETE
306,306,0.6067673992673993,2023-11-15 16:00:18.535134,2023-11-15 16:01:33.043687,0 days 00:01:14.508553,cosine,0.3817409918003931,18,COMPLETE
307,307,0.6401007326007326,2023-11-15 16:01:33.053266,2023-11-15 16:02:50.716828,0 days 00:01:17.663562,euclidean,0.5493689436693465,10,COMPLETE
308,308,0.6567673992673992,2023-11-15 16:02:50.727653,2023-11-15 16:04:57.218272,0 days 00:02:06.490619,minkowski,0.1205168218452513,12,COMPLETE
309,309,0.6067673992673993,2023-11-15 16:04:57.224703,2023-11-15 16:06:11.960462,0 days 00:01:14.735759,cosine,0.4301151364466783,9,COMPLETE
310,310,0.6301007326007326,2023-11-15 16:06:11.968644,2023-11-15 16:07:30.044916,0 days 00:01:18.076272,euclidean,0.3232366739942667,11,COMPLETE
311,311,0.6067673992673993,2023-11-15 16:07:30.049552,2023-11-15 16:08:48.654348,0 days 00:01:18.604796,cosine,0.09812512545110166,10,COMPLETE
312,312,0.6167673992673992,2023-11-15 16:08:48.662888,2023-11-15 16:10:08.064840,0 days 00:01:19.401952,euclidean,0.5811761588541801,19,COMPLETE
313,313,0.6667673992673993,2023-11-15 16:10:08.072373,2023-11-15 16:11:22.803924,0 days 00:01:14.731551,cosine,0.041820764228182844,11,COMPLETE
314,314,0.6442673992673993,2023-11-15 16:11:22.811094,2023-11-15 16:12:42.371420,0 days 00:01:19.560326,cosine,0.3623310323070618,10,COMPLETE
315,315,0.6667673992673993,2023-11-15 16:12:42.380217,2023-11-15 16:13:56.074757,0 days 00:01:13.694540,euclidean,0.062491759817281334,8,COMPLETE
316,316,0.6967673992673993,2023-11-15 16:13:56.082776,2023-11-15 16:16:02.316613,0 days 00:02:06.233837,minkowski,0.22263138746790373,9,COMPLETE
317,317,0.5942673992673992,2023-11-15 16:16:02.327099,2023-11-15 16:18:06.573564,0 days 00:02:04.246465,minkowski,0.25799120816553045,9,COMPLETE
318,318,0.5942673992673992,2023-11-15 16:18:06.579761,2023-11-15 16:20:14.498701,0 days 00:02:07.918940,minkowski,0.22147195568961456,9,COMPLETE
319,319,0.6167673992673992,2023-11-15 16:20:14.507085,2023-11-15 16:22:30.492198,0 days 00:02:15.985113,minkowski,0.13156340546185255,18,COMPLETE
320,320,0.6442673992673993,2023-11-15 16:22:30.496768,2023-11-15 16:24:41.013299,0 days 00:02:10.516531,minkowski,0.23779018434371607,8,COMPLETE
321,321,0.6067673992673993,2023-11-15 16:24:41.023302,2023-11-15 16:26:51.699097,0 days 00:02:10.675795,minkowski,0.03306687573497401,9,COMPLETE
322,322,0.5942673992673992,2023-11-15 16:26:51.706812,2023-11-15 16:28:55.274917,0 days 00:02:03.568105,minkowski,0.21682816716694517,11,COMPLETE
323,323,0.6167673992673992,2023-11-15 16:28:55.285845,2023-11-15 16:30:10.838061,0 days 00:01:15.552216,cosine,0.2872674180639813,9,COMPLETE
324,324,0.5942673992673992,2023-11-15 16:30:10.844664,2023-11-15 16:31:25.138149,0 days 00:01:14.293485,euclidean,0.2713425531257079,19,COMPLETE
325,325,0.6967673992673993,2023-11-15 16:31:25.146701,2023-11-15 16:32:46.332166,0 days 00:01:21.185465,cosine,0.39271985661667735,12,COMPLETE
326,326,0.6167673992673992,2023-11-15 16:32:46.343843,2023-11-15 16:34:07.756755,0 days 00:01:21.412912,cosine,0.4194338675007715,12,COMPLETE
327,327,0.6442673992673993,2023-11-15 16:34:07.764419,2023-11-15 16:35:27.368919,0 days 00:01:19.604500,euclidean,0.3984704957917991,12,COMPLETE
328,328,0.6539102564102565,2023-11-15 16:35:27.375687,2023-11-15 16:36:42.589579,0 days 00:01:15.213892,cosine,0.38027238708694094,13,COMPLETE
329,329,0.6067673992673993,2023-11-15 16:36:42.598699,2023-11-15 16:38:52.293392,0 days 00:02:09.694693,minkowski,0.05302071451871835,12,COMPLETE
330,330,0.6567673992673992,2023-11-15 16:38:52.304599,2023-11-15 16:40:08.137708,0 days 00:01:15.833109,cosine,0.16839582981031612,11,COMPLETE
331,331,0.6167673992673992,2023-11-15 16:40:08.146339,2023-11-15 16:41:21.380007,0 days 00:01:13.233668,euclidean,0.026376478618153433,13,COMPLETE
332,332,0.6342673992673993,2023-11-15 16:41:21.387002,2023-11-15 16:42:35.301146,0 days 00:01:13.914144,cosine,0.08634754078300197,10,COMPLETE
333,333,0.6442673992673993,2023-11-15 16:42:35.308200,2023-11-15 16:43:51.517588,0 days 00:01:16.209388,euclidean,0.4115914831226223,11,COMPLETE
334,334,0.6567673992673992,2023-11-15 16:43:51.533665,2023-11-15 16:45:06.341470,0 days 00:01:14.807805,cosine,0.0694719814994601,9,COMPLETE
335,335,0.6401007326007326,2023-11-15 16:45:06.346801,2023-11-15 16:46:20.526115,0 days 00:01:14.179314,euclidean,0.25192982159308774,10,COMPLETE
336,336,0.6542673992673993,2023-11-15 16:46:20.535175,2023-11-15 16:47:38.638407,0 days 00:01:18.103232,cosine,0.14673136846178786,11,COMPLETE
337,337,0.6167673992673992,2023-11-15 16:47:38.643751,2023-11-15 16:49:40.347337,0 days 00:02:01.703586,minkowski,0.19352876396438587,8,COMPLETE
338,338,0.6567673992673992,2023-11-15 16:49:40.355631,2023-11-15 16:50:52.542450,0 days 00:01:12.186819,euclidean,0.3923660122892338,10,COMPLETE
339,339,0.6567673992673992,2023-11-15 16:50:52.547572,2023-11-15 16:52:07.575486,0 days 00:01:15.027914,cosine,0.4395163118525315,12,COMPLETE
340,340,0.6067673992673993,2023-11-15 16:52:07.583055,2023-11-15 16:53:25.179797,0 days 00:01:17.596742,cosine,0.30682578681465555,9,COMPLETE
341,341,0.6567673992673992,2023-11-15 16:53:25.188583,2023-11-15 16:54:39.352690,0 days 00:01:14.164107,euclidean,0.10616687727123449,11,COMPLETE
342,342,0.5942673992673992,2023-11-15 16:54:39.359089,2023-11-15 16:55:54.040515,0 days 00:01:14.681426,cosine,0.02382691323628878,10,COMPLETE
343,343,0.6139102564102564,2023-11-15 16:55:54.048152,2023-11-15 16:57:06.959067,0 days 00:01:12.910915,euclidean,0.34221140342402506,8,COMPLETE
344,344,0.6967673992673993,2023-11-15 16:57:06.968227,2023-11-15 16:58:26.128730,0 days 00:01:19.160503,cosine,0.3585570966694994,11,COMPLETE
345,345,0.6126007326007326,2023-11-15 16:58:26.136337,2023-11-15 16:59:41.369651,0 days 00:01:15.233314,cosine,0.36129829896085863,12,COMPLETE
346,346,0.6194871794871795,2023-11-15 16:59:41.379410,2023-11-15 17:00:51.003509,0 days 00:01:09.624099,cosine,0.3776057422486504,11,COMPLETE
347,347,0.6092673992673994,2023-11-15 17:00:51.009196,2023-11-15 17:02:04.412426,0 days 00:01:13.403230,cosine,0.34073241152769246,11,COMPLETE
348,348,0.6467673992673993,2023-11-15 17:02:04.417725,2023-11-15 17:03:21.322122,0 days 00:01:16.904397,cosine,0.1811531238827625,11,COMPLETE
349,349,0.6667673992673993,2023-11-15 17:03:21.327380,2023-11-15 17:04:36.164458,0 days 00:01:14.837078,cosine,0.36308297931868616,12,COMPLETE
350,350,0.6814102564102564,2023-11-15 17:04:36.171120,2023-11-15 17:05:49.723432,0 days 00:01:13.552312,cosine,0.2278260809990179,10,COMPLETE
351,351,0.6598443223443223,2023-11-15 17:05:49.728484,2023-11-15 17:07:55.587838,0 days 00:02:05.859354,minkowski,0.5001505015908937,10,COMPLETE
352,352,0.5942673992673992,2023-11-15 17:07:55.595312,2023-11-15 17:09:07.932794,0 days 00:01:12.337482,cosine,0.12193146515509684,9,COMPLETE
353,353,0.6592673992673993,2023-11-15 17:09:07.940644,2023-11-15 17:10:22.855295,0 days 00:01:14.914651,euclidean,0.4170179842194753,11,COMPLETE
354,354,0.6567673992673992,2023-11-15 17:10:22.862085,2023-11-15 17:11:35.711227,0 days 00:01:12.849142,cosine,0.15672840304394048,9,COMPLETE
355,355,0.5931776556776557,2023-11-15 17:11:35.718176,2023-11-15 17:12:51.845328,0 days 00:01:16.127152,euclidean,0.21172779210484186,10,COMPLETE
356,356,0.6567673992673992,2023-11-15 17:12:51.849913,2023-11-15 17:14:05.580589,0 days 00:01:13.730676,cosine,0.8162682294671091,13,COMPLETE
357,357,0.6067673992673993,2023-11-15 17:14:05.589257,2023-11-15 17:15:17.976420,0 days 00:01:12.387163,euclidean,0.4487157904156289,11,COMPLETE
358,358,0.6342673992673993,2023-11-15 17:15:17.982450,2023-11-15 17:16:32.382202,0 days 00:01:14.399752,cosine,0.32328149799788186,12,COMPLETE
359,359,0.6567673992673992,2023-11-15 17:16:32.387243,2023-11-15 17:18:39.232529,0 days 00:02:06.845286,minkowski,0.39123172927787964,10,COMPLETE
360,360,0.5942673992673992,2023-11-15 17:18:39.238371,2023-11-15 17:19:53.322357,0 days 00:01:14.083986,cosine,0.48185367851431427,2,COMPLETE
361,361,0.6301007326007326,2023-11-15 17:19:53.328732,2023-11-15 17:21:06.018733,0 days 00:01:12.690001,euclidean,0.07613431895054114,11,COMPLETE
362,362,0.6167673992673992,2023-11-15 17:21:06.027872,2023-11-15 17:22:20.638524,0 days 00:01:14.610652,cosine,0.5200108536437212,9,COMPLETE
363,363,0.6342673992673993,2023-11-15 17:22:20.644282,2023-11-15 17:23:37.220003,0 days 00:01:16.575721,euclidean,0.09907989634452653,10,COMPLETE
364,364,0.6342673992673993,2023-11-15 17:23:37.224883,2023-11-15 17:24:51.155107,0 days 00:01:13.930224,cosine,0.2686037315938824,10,COMPLETE
365,365,0.6001007326007326,2023-11-15 17:24:51.160162,2023-11-15 17:26:54.084438,0 days 00:02:02.924276,minkowski,0.2992859437020963,8,COMPLETE
366,366,0.6467673992673993,2023-11-15 17:26:54.089641,2023-11-15 17:28:06.524442,0 days 00:01:12.434801,euclidean,0.1334048186103746,12,COMPLETE
367,367,0.6301007326007326,2023-11-15 17:28:06.529845,2023-11-15 17:29:23.394349,0 days 00:01:16.864504,cosine,0.41613474292004005,11,COMPLETE
368,368,0.6567673992673992,2023-11-15 17:29:23.399163,2023-11-15 17:30:37.498411,0 days 00:01:14.099248,cosine,0.06030579554587037,9,COMPLETE
369,369,0.5942673992673992,2023-11-15 17:30:37.509058,2023-11-15 17:31:52.902604,0 days 00:01:15.393546,euclidean,0.3646704628223981,20,COMPLETE
370,370,0.6042673992673993,2023-11-15 17:31:52.909279,2023-11-15 17:33:07.034775,0 days 00:01:14.125496,cosine,0.045672588572830325,10,COMPLETE
371,371,0.6567673992673992,2023-11-15 17:33:07.040415,2023-11-15 17:34:23.675758,0 days 00:01:16.635343,manhattan,0.2384240964035733,11,COMPLETE
372,372,0.5776007326007326,2023-11-15 17:34:23.682585,2023-11-15 17:35:35.915885,0 days 00:01:12.233300,euclidean,0.3970227873229983,10,COMPLETE
373,373,0.6467673992673993,2023-11-15 17:35:35.925329,2023-11-15 17:37:40.683227,0 days 00:02:04.757898,minkowski,0.727418646029337,11,COMPLETE
374,374,0.6167673992673992,2023-11-15 17:37:40.688788,2023-11-15 17:38:52.379341,0 days 00:01:11.690553,cosine,0.46390436400961477,9,COMPLETE
375,375,0.6567673992673992,2023-11-15 17:38:52.388538,2023-11-15 17:40:08.831149,0 days 00:01:16.442611,manhattan,0.1958780321878647,10,COMPLETE
376,376,0.6967673992673993,2023-11-15 17:40:08.836216,2023-11-15 17:41:23.265928,0 days 00:01:14.429712,euclidean,0.3351862718002235,10,COMPLETE
377,377,0.6442673992673993,2023-11-15 17:41:23.273836,2023-11-15 17:42:37.260149,0 days 00:01:13.986313,cosine,0.3390660552774607,11,COMPLETE
378,378,0.6167673992673992,2023-11-15 17:42:37.267025,2023-11-15 17:43:51.076539,0 days 00:01:13.809514,cosine,0.3186236680571661,8,COMPLETE
379,379,0.5817673992673993,2023-11-15 17:43:51.081854,2023-11-15 17:45:05.340427,0 days 00:01:14.258573,euclidean,0.35311455366973077,14,COMPLETE
380,380,0.7367673992673993,2023-11-15 17:45:05.353383,2023-11-15 17:46:25.730576,0 days 00:01:20.377193,manhattan,0.29798608347734,9,COMPLETE
381,381,0.6342673992673993,2023-11-15 17:46:25.747969,2023-11-15 17:47:41.268256,0 days 00:01:15.520287,manhattan,0.2912705355419222,9,COMPLETE
382,382,0.6967673992673993,2023-11-15 17:47:41.282365,2023-11-15 17:48:54.836964,0 days 00:01:13.554599,manhattan,0.3252006139362913,9,COMPLETE
383,383,0.6067673992673993,2023-11-15 17:48:54.844798,2023-11-15 17:50:07.317759,0 days 00:01:12.472961,manhattan,0.3119775342212321,9,COMPLETE
384,384,0.6442673992673993,2023-11-15 17:50:07.322552,2023-11-15 17:51:23.302792,0 days 00:01:15.980240,manhattan,0.2899487915621682,9,COMPLETE
385,385,0.5817673992673993,2023-11-15 17:51:23.308038,2023-11-15 17:52:38.281839,0 days 00:01:14.973801,manhattan,0.32407728220727217,9,COMPLETE
386,386,0.6401007326007326,2023-11-15 17:52:38.292100,2023-11-15 17:53:53.445166,0 days 00:01:15.153066,manhattan,0.340271672904668,9,COMPLETE
387,387,0.5692673992673993,2023-11-15 17:53:53.454352,2023-11-15 17:55:05.918428,0 days 00:01:12.464076,manhattan,0.25575046098503607,8,COMPLETE
388,388,0.7117673992673993,2023-11-15 17:55:05.924097,2023-11-15 17:56:23.714665,0 days 00:01:17.790568,manhattan,0.3326958078880573,10,COMPLETE
389,389,0.6467673992673993,2023-11-15 17:56:23.726416,2023-11-15 17:57:36.778651,0 days 00:01:13.052235,manhattan,0.3761401849563246,10,COMPLETE
390,390,0.6567673992673992,2023-11-15 17:57:36.785634,2023-11-15 17:58:51.777138,0 days 00:01:14.991504,manhattan,0.32637379682478196,10,COMPLETE
391,391,0.6967673992673993,2023-11-15 17:58:51.786308,2023-11-15 18:00:06.585817,0 days 00:01:14.799509,manhattan,0.35090893057700945,10,COMPLETE
392,392,0.6667673992673993,2023-11-15 18:00:06.596902,2023-11-15 18:01:25.806592,0 days 00:01:19.209690,manhattan,0.34362784400841245,10,COMPLETE
393,393,0.6067673992673993,2023-11-15 18:01:25.813188,2023-11-15 18:02:38.882386,0 days 00:01:13.069198,manhattan,0.3592889377070884,4,COMPLETE
394,394,0.6492673992673993,2023-11-15 18:02:38.887958,2023-11-15 18:03:48.966767,0 days 00:01:10.078809,manhattan,0.3074872248525098,10,COMPLETE
395,395,0.6042673992673993,2023-11-15 18:03:48.976359,2023-11-15 18:05:03.763471,0 days 00:01:14.787112,manhattan,0.375696419098471,10,COMPLETE
396,396,0.6442673992673993,2023-11-15 18:05:03.769136,2023-11-15 18:06:21.389742,0 days 00:01:17.620606,manhattan,0.35464890167741087,9,COMPLETE
397,397,0.6067673992673993,2023-11-15 18:06:21.399252,2023-11-15 18:07:33.572697,0 days 00:01:12.173445,euclidean,0.3274123706185981,8,COMPLETE
398,398,0.6467673992673993,2023-11-15 18:07:33.580174,2023-11-15 18:09:37.691459,0 days 00:02:04.111285,minkowski,0.97139816912487,10,COMPLETE
399,399,0.6873443223443224,2023-11-15 18:09:37.701868,2023-11-15 18:10:53.894113,0 days 00:01:16.192245,manhattan,0.38771102329280327,10,COMPLETE
400,400,0.6042673992673993,2023-11-15 18:10:53.901938,2023-11-15 18:12:07.338323,0 days 00:01:13.436385,euclidean,0.3412623026081074,9,COMPLETE
401,401,0.6067673992673993,2023-11-15 18:12:07.346213,2023-11-15 18:13:26.017217,0 days 00:01:18.671004,manhattan,0.366114177904043,11,COMPLETE
402,402,0.6867673992673993,2023-11-15 18:13:26.024615,2023-11-15 18:14:39.840809,0 days 00:01:13.816194,euclidean,0.40319474685293266,10,COMPLETE
403,403,0.7367673992673993,2023-11-15 18:14:39.848058,2023-11-15 18:15:55.175558,0 days 00:01:15.327500,manhattan,0.3294093609567241,11,COMPLETE
404,404,0.6467673992673993,2023-11-15 18:15:55.181054,2023-11-15 18:17:09.022724,0 days 00:01:13.841670,manhattan,0.3359182271184729,12,COMPLETE
405,405,0.6176007326007327,2023-11-15 18:17:09.032695,2023-11-15 18:18:28.128516,0 days 00:01:19.095821,manhattan,0.3028581138244591,11,COMPLETE
406,406,0.6217673992673993,2023-11-15 18:18:28.137975,2023-11-15 18:19:41.180574,0 days 00:01:13.042599,manhattan,0.31406119096616336,11,COMPLETE
407,407,0.6401007326007326,2023-11-15 18:19:41.185757,2023-11-15 18:20:55.705890,0 days 00:01:14.520133,manhattan,0.349276265162875,11,COMPLETE
408,408,0.5942673992673992,2023-11-15 18:20:55.712402,2023-11-15 18:22:07.761947,0 days 00:01:12.049545,manhattan,0.382477122219733,8,COMPLETE
409,409,0.6567673992673992,2023-11-15 18:22:07.768823,2023-11-15 18:23:25.612755,0 days 00:01:17.843932,manhattan,0.2793553043858448,12,COMPLETE
410,410,0.6567673992673992,2023-11-15 18:23:25.618566,2023-11-15 18:24:37.929424,0 days 00:01:12.310858,manhattan,0.3264898524244284,11,COMPLETE
411,411,0.6217673992673993,2023-11-15 18:24:37.934781,2023-11-15 18:26:39.911852,0 days 00:02:01.977071,minkowski,0.42746289824426253,10,COMPLETE
412,412,0.6973443223443223,2023-11-15 18:26:39.918545,2023-11-15 18:27:54.280564,0 days 00:01:14.362019,manhattan,0.36338716543331306,12,COMPLETE
413,413,0.6067673992673993,2023-11-15 18:27:54.286664,2023-11-15 18:29:09.411188,0 days 00:01:15.124524,manhattan,0.350816549082228,13,COMPLETE
414,414,0.5776007326007326,2023-11-15 18:29:09.416173,2023-11-15 18:30:21.269724,0 days 00:01:11.853551,manhattan,0.31117421438988746,12,COMPLETE
415,415,0.5942673992673992,2023-11-15 18:30:21.275356,2023-11-15 18:31:34.764952,0 days 00:01:13.489596,manhattan,0.40284539623568794,11,COMPLETE
416,416,0.7067673992673993,2023-11-15 18:31:34.770867,2023-11-15 18:32:49.791864,0 days 00:01:15.020997,manhattan,0.3656879474755902,13,COMPLETE
417,417,0.6967673992673993,2023-11-15 18:32:49.799764,2023-11-15 18:34:03.969809,0 days 00:01:14.170045,manhattan,0.37603002748312064,13,COMPLETE
418,418,0.6067673992673993,2023-11-15 18:34:03.977436,2023-11-15 18:35:23.133370,0 days 00:01:19.155934,manhattan,0.3664214272971339,13,COMPLETE
419,419,0.6514102564102564,2023-11-15 18:35:23.142394,2023-11-15 18:36:37.165222,0 days 00:01:14.022828,manhattan,0.43100134248057737,14,COMPLETE
420,420,0.6473443223443224,2023-11-15 18:36:37.170639,2023-11-15 18:37:52.176580,0 days 00:01:15.005941,manhattan,0.33145944241032455,12,COMPLETE
421,421,0.6467673992673993,2023-11-15 18:37:52.183444,2023-11-15 18:39:10.062796,0 days 00:01:17.879352,manhattan,0.5765092780142708,14,COMPLETE
422,422,0.6067673992673993,2023-11-15 18:39:10.073477,2023-11-15 18:41:18.498481,0 days 00:02:08.425004,minkowski,0.28608376473624086,12,COMPLETE
423,423,0.6067673992673993,2023-11-15 18:41:18.503893,2023-11-15 18:42:34.822420,0 days 00:01:16.318527,manhattan,0.5285982222672634,13,COMPLETE
424,424,0.6014102564102564,2023-11-15 18:42:34.828446,2023-11-15 18:43:50.923496,0 days 00:01:16.095050,manhattan,0.39295924422741907,12,COMPLETE
425,425,0.6067673992673993,2023-11-15 18:43:50.933020,2023-11-15 18:45:06.180820,0 days 00:01:15.247800,manhattan,0.26644063387296685,11,COMPLETE
426,426,0.6280769230769231,2023-11-15 18:45:06.188183,2023-11-15 18:46:20.054318,0 days 00:01:13.866135,manhattan,0.4098398671298489,12,COMPLETE
427,427,0.6067673992673993,2023-11-15 18:46:20.064183,2023-11-15 18:48:26.740761,0 days 00:02:06.676578,minkowski,0.6260586696811459,13,COMPLETE
428,428,0.6567673992673992,2023-11-15 18:48:26.749956,2023-11-15 18:49:40.667560,0 days 00:01:13.917604,manhattan,0.2989761392333272,11,COMPLETE
429,429,0.6067673992673993,2023-11-15 18:49:40.675356,2023-11-15 18:50:55.420323,0 days 00:01:14.744967,manhattan,0.3712332078961923,11,COMPLETE
430,430,0.6567673992673992,2023-11-15 18:50:55.429418,2023-11-15 18:52:10.391968,0 days 00:01:14.962550,manhattan,0.026040334016991566,9,COMPLETE
431,431,0.6442673992673993,2023-11-15 18:52:10.399311,2023-11-15 18:53:28.177262,0 days 00:01:17.777951,euclidean,0.3256918761239419,13,COMPLETE
432,432,0.5970238095238095,2023-11-15 18:53:28.183788,2023-11-15 18:55:33.043392,0 days 00:02:04.859604,minkowski,0.44834739738754364,12,COMPLETE
433,433,0.6442673992673993,2023-11-15 18:55:33.050093,2023-11-15 18:56:48.592662,0 days 00:01:15.542569,manhattan,0.55358576689682,7,COMPLETE
434,434,0.6342673992673993,2023-11-15 18:56:48.601462,2023-11-15 18:58:02.647328,0 days 00:01:14.045866,euclidean,0.05378131022860335,14,COMPLETE
435,435,0.6567673992673992,2023-11-15 18:58:02.655137,2023-11-15 18:59:16.824707,0 days 00:01:14.169570,manhattan,0.0813652446061558,9,COMPLETE
436,436,0.6467673992673993,2023-11-15 18:59:16.834643,2023-11-15 19:00:34.579681,0 days 00:01:17.745038,manhattan,0.3479737328215278,11,COMPLETE
437,437,0.6001007326007326,2023-11-15 19:00:34.586596,2023-11-15 19:01:50.662970,0 days 00:01:16.076374,euclidean,0.38605859631131867,8,COMPLETE
438,438,0.6067673992673993,2023-11-15 19:01:50.669999,2023-11-15 19:03:54.985311,0 days 00:02:04.315312,minkowski,0.9245582792846049,11,COMPLETE
439,439,0.6467673992673993,2023-11-15 19:03:54.990738,2023-11-15 19:05:10.104162,0 days 00:01:15.113424,manhattan,0.4982619038236312,10,COMPLETE
440,440,0.6967673992673993,2023-11-15 19:05:10.113074,2023-11-15 19:06:24.489638,0 days 00:01:14.376564,euclidean,0.42530133896903827,12,COMPLETE
441,441,0.6442673992673993,2023-11-15 19:06:24.497431,2023-11-15 19:07:43.386022,0 days 00:01:18.888591,manhattan,0.310522900632667,11,COMPLETE
442,442,0.6617673992673992,2023-11-15 19:07:43.393624,2023-11-15 19:08:57.217507,0 days 00:01:13.823883,manhattan,0.018181609072649443,9,COMPLETE
443,443,0.6467673992673993,2023-11-15 19:08:57.229951,2023-11-15 19:10:12.780423,0 days 00:01:15.550472,euclidean,0.36596811469933616,10,COMPLETE
444,444,0.7242673992673992,2023-11-15 19:10:12.788398,2023-11-15 19:11:26.199095,0 days 00:01:13.410697,manhattan,0.04441218882512589,9,COMPLETE
445,445,0.6467673992673993,2023-11-15 19:11:26.207559,2023-11-15 19:13:33.131583,0 days 00:02:06.924024,minkowski,0.041166000504175765,11,COMPLETE
446,446,0.6042673992673993,2023-11-15 19:13:33.138832,2023-11-15 19:14:50.340401,0 days 00:01:17.201569,euclidean,0.0730327203144556,10,COMPLETE
447,447,0.6467673992673993,2023-11-15 19:14:50.349913,2023-11-15 19:16:05.166553,0 days 00:01:14.816640,manhattan,0.039296091799760104,12,COMPLETE
448,448,0.6067673992673993,2023-11-15 19:16:05.173212,2023-11-15 19:17:20.395401,0 days 00:01:15.222189,manhattan,0.09654672594047366,10,COMPLETE
449,449,0.6067673992673993,2023-11-15 19:17:20.406278,2023-11-15 19:18:33.984221,0 days 00:01:13.577943,euclidean,0.013005929508346947,9,COMPLETE
450,450,0.6217673992673993,2023-11-15 19:18:33.992058,2023-11-15 19:19:53.571123,0 days 00:01:19.579065,manhattan,0.054031700595973876,11,COMPLETE
451,451,0.7067673992673993,2023-11-15 19:19:53.578686,2023-11-15 19:21:08.276461,0 days 00:01:14.697775,cosine,0.4090768164016618,13,COMPLETE
452,452,0.6167673992673992,2023-11-15 19:21:08.284834,2023-11-15 19:22:23.825470,0 days 00:01:15.540636,cosine,0.40724919890510397,13,COMPLETE
